Periódico,Hipervínculo,Fecha publicación,Titular,Subtítulo,Target,Cuerpo
El Mundo Today,https://www.elmundotoday.com/2023/02/una-mujer-acude-a-una-primera-cita-con-su-ferula-de-descarga-porque-quiere-mostrarse-tal-y-como-es/,2023-02-27,Una mujer acude a una primera cita con su férula de descarga porque quiere mostrarse tal y como es,"“FO FOFORTO A FOR HIFOFRITAS”, HA DICHO ESCUPIENDO TROZOS DE COMIDA",1,"
Cansada de las falsas apariencias y de las relaciones superficiales, Marisa Cordero, de 27 años, ha decidido acudir a una primera cita con su férula de descarga porque quiere mostrarse tal y como es. La joven ha querido evitarle futuras sorpresas al chico que empieza a conocer y ha optado por ser totalmente transparente. «Afí foy yo for laf nofes, lo tomaf o lo fefas», le ha dicho justo después de saludarlo.
Sebastián Soplillo, de 25 años, se ha mostrado receptivo a la presencia de la férula de descarga y ha accedido a seguir conociendo a Marisa pese a la difícil comunicación. «Al final pasa la mayor parte del tiempo con la férula, así que me parece bien que haya querido presentarse con ella», confirma. «El único problema es que beber con eso puesto no es nada fácil», añade. «Pronunciar mi nombre le supone toda una odisea y tampoco entiendo bien sus otras palabras», dice.
Durante el transcurso de la cena, Marisa ha hecho toda una declaración de intenciones: «Fo foforto a fos hifofritas», ha sentenciado escupiendo trozos de comida. «Tengo brufifmo, fí, ¿alfún froflema con efo?», le ha preguntado a un descolocado Sebastián. «Si supiera que la comunicación iba a ser tan complicada habría propuesto un plan de cine y no de cena», se sincera ahora el joven. Aunque Marisa le ha gustado, Sebastián no se ha atrevido a besarla debido a la presencia de la férula.
No es la primera vez que Marisa acude a una cita con una actitud semejante. El año pasado ya se presentó en un restaurante con el pijama y unas bragas marrones enormes para que la persona a la que estaba conociendo supiera cómo es ella los días en los que tiene la regla.
"
El Mundo Today,https://www.elmundotoday.com/2023/02/ver-que-hace-aragones-al-encontrarse-con-el-rey-ya-es-el-unico-atractivo-del-mobile-world-congress-confirman-los-expertos/,2023-02-27,"Ver qué hace Aragonès al encontrarse con el Rey ya es el único atractivo del Mobile World Congress, confirman los expertos","""PUES YA ESTÁ TODO VISTO"", HA DICHO EL CEO DE SAMSUNG TRAS EL SALUDO ENTRE SU MAJESTAD Y EL PRESIDENT",1,"
Ver de qué manera evitan Ada Colau y Pere Aragonès a Su Majestad Felipe VI, para luego verse forzados a saludarlo igualmente en el momento de la foto oficial, es ya el único atractivo que tiene el Mobile World Congress que se celebra cada año en Barcelona. «Hay mucha saturación con la tecnología, aquí la gente viene por el numerito del saludo», confirma el presidente de Fira de Barcelona, Pau Relat.
«Se hicieron de rogar faltando al besamanos y estábamos todos emocionadísimos, cada año nos hacen creer que habrá desplante pero luego no, siempre encuentran la manera de mantener la tensión», confiesa Lee Jae-yong, presidente de Samsung, que regresó a Corea nada más terminar el saludo de Aragonès y Felipe VI. «Pues nada, está todo visto. El año que viene más», zanjaba el directivo.
Los pabellones que albergaban el congreso se vaciaron en menos de media hora una vez finalizadas las salutaciones. «Los de Nokia se quedan porque traen móvil nuevo, los pobres. Deberían patrocinar el saludo de Colau para que alguien les hiciera caso», señalaba con sarcasmo el presidente ejecutivo de Telefónica, José María Álvarez Pallete.
No conforme con la expectación que levanta siempre su saludo a regañadientes, Pere Aragonès ha sorprendido en el último minuto pidiéndole a una inteligencia artificial que proclamara la independencia de Cataluña. «Lo siento, habla en castellano, no te he entendido», le ha respondido el sistema, provocando risotadas entre los organizadores.
"
El Mundo Today,https://www.elmundotoday.com/2023/02/tras-perder-frente-al-almeria-el-barca-pregunta-cuando-puede-volver-a-comprar-arbitros/,2023-02-27,"Tras perder frente al Almería, el Barça pregunta cuándo puede volver a comprar árbitros",RESUMEN DE LA JORNADA,1,"
Elche 2-3 Betis
El Betis gana siempre y nunca sube del quinto puesto porque el encargado de sumar los puntos es analfabeto.
Espanyol 2-1 Mallorca
El Espanyol lleva años sobornando a cuartos árbitros porque no tiene dinero para sobornar al árbitro principal.
Cádiz 1-0 Rayo Vallecano
Debido a esta derrota del Rayo, la participación en el 8M será de las más bajas que se recuerden.
Real Madrid 1-1 Atlético de Madrid
En el Bernabéu sospechan que el Barça paga a árbitros para que favorezcan al Real Madrid y así no se sospeche tanto de ellos.
Valencia 1-0 Real Sociedad
Los jugadores del Valencia se aferraron a la vida literalmente porque, como bajen, su afición los mata.
Athletic 2-3 Girona
El Girona demostró que se pueden ganar partidos sin sobornar a los árbitros.
Celta 3-0 Valladolid
Desde que quitaron las luces de Navidad, los jugadores del Celta pueden ver bien el campo y juegan mejor.
Almería 1-0 Barcelona
Tras perder frente al Almería, el Barça pregunta cuándo puede volver a comprar árbitros.
Sevilla 2-3 Osasuna
El Sevilla sigue compitiendo con el Valencia por ser la mayor decepción de la temporada.
Villarreal-Getafe
El Getafe no recuerda la última vez que tuvo que trabajar en fin de semana.
"
El Mundo Today,https://www.elmundotoday.com/2023/02/unos-pasajeros-muy-poco-exigentes-aplauden-justo-despues-de-que-el-avion-se-estrelle/,2023-02-24,Unos pasajeros muy poco exigentes aplauden justo después de que el avión se estrelle,"“¡NI CASO A LOS HATERS! ¡AL MENOS LO HAS INTENTADO!”, HAN GRITADO ENTRE LOS ESCOMBROS",1,"
En la tarde de ayer, unos pasajeros muy poco exigentes aplaudieron justo después de que el avión en el que viajaban se estrellase. Los hechos se produjeron en el vuelo 450 de Londres a Nueva York. Cuando faltaban apenas unos kilómetros para tomar tierra, debido al viento el avión comenzó a descender a gran velocidad y acabó chocando contra el mar. Los pasajeros, antes de morir, en lugar de quejarse, aplaudieron al piloto y le agradecieron el esfuerzo.
“¡Pilotar un avión es muy difícil y tú has tenido el valor de intentarlo!”, le animaba un pasajero con las dos piernas rotas situado en la cola del avión. “¡Ha sido muy emocionante y, aunque ha salido mal, la experiencia siempre quedará con nosotros!”, añadió entre las llamas una mujer con unas gravísimas heridas internas. “¡No hemos llegado a Nueva York, pero estamos mucho más cerca, bravo!”, agradeció un pasajero instantes antes de exhalar su último aliento.
Como el piloto estaba afectado debido al accidente, los pasajeros poco exigentes se esforzaron por animarle. “¡Ni caso a los haters! ¡Al menos lo has intentado!”, chillaron entre los escombros. “Cuanto más arriba estás, más te quieren bajar, tú sigue como hasta ahora y no hagas caso a las críticas”, le decían mientras el fuselaje ardiente se empezaba a sumergir bajo el Atlántico.
Antes de fallecer por las heridas, el piloto tuvo unas emotivas palabras de agradecimiento para los pasajeros. “No es mi primer accidente, de hecho he tenido muchos, pero jamás me habían arropado tanto, ha sido un honor chocar con vosotros, ojalá poder repetir algún día”, dijo provocando una última ovación.
"
El Mundo Today,https://www.elmundotoday.com/2023/02/el-gobierno-no-solo-subira-la-cuota-de-los-autonomos-sino-que-tras-un-acuerdo-con-zelenski-los-enviara-a-combatir-a-ucrania/,2023-02-24,"El Gobierno no solo subirá la cuota de los autónomos sino que, tras un acuerdo con Zelenski, los enviará a combatir a Ucrania","""TIENEN HORARIOS FLEXIBLES, ASÍ QUE PUEDEN INCORPORARSE A LA GUERRA YA MISMO"", DIJO EL PRESIDENTE",1,"
España se ha comprometido a enviar 10 carros de combate Leopard 2A4 a Ucrania y 3.329.863 autónomos. Lo anunció el propio presidente del Gobierno en una visita relámpago a Kiev este jueves, víspera del aniversario de la invasión. Con este gesto, Pedro Sánchez eleva el perfil español entre los donantes de material bélico con unos equipos de segunda mano y más de tres millones de trabajadores por cuenta propia. «Son personas valientes acostumbradas a sacrificarlo todo sin rechistar», prometió Sánchez al pueblo ucraniano.
Sánchez ha asegurado que la entrega de los carros de combate se realizará «en las próximas semanas o meses”, pero que los autónomos pueden incorporarse a las filas ucranianas “desde hoy mismo, dado que tienen horarios flexibles, al ser autónomos”. Lo dijo ayer en una rueda de prensa junto al presidente de Ucrania, que se mostró muy agradecido.
“Al ser vuestros propios jefes, lo tenéis más fácil para conciliar”, dijo Sánchez, dirigiéndose a los autónomos y agradeciéndoles su espíritu “emprendedor”.
“Los trabajadores asalariados españoles no pueden ausentarse del trabajo, pero los autónomos sí, de ahí que sean la carne de cañón que Europa necesita ahora mismo”, explicó Pedro Sánchez. Los autónomos, dijo, son también personas acostumbradas a “jugarse el cuello con todo lo que tienen” y a implicarse en los proyectos de forma «intensa y total, hasta las últimas consecuencias, sean las que sean”. 
“Son personas que, a priori, tampoco van a tener mucha pensión de jubilación, por lo que quizá una guerra les quita un problema, no sé si me explico”, dijo también Sánchez sin explicitar a qué se refería. 
Zelenski agradeció el gesto diplomático español y dejó claro que el ejército ucraniano acepta tanto a los autónomos como a los falsos autónomos sin distinción.
Por su parte, el Ministerio de Seguridad Social ha confirmado que está negociando con Bruselas un nuevo incremento de cuotas.
"
El Mundo Today,https://www.elmundotoday.com/2023/02/nutriscore-puntua-con-una-a-una-bolsa-de-basura-que-sobresale-de-un-contenedor-de-barcelona/,2023-02-24,Nutriscore puntúa con una A una bolsa de basura que sobresale de un contenedor de Barcelona,EL CAMIÓN QUE LA HA RECOGIDO PODRÍA GANAR UNA ESTRELLA MICHELIN,1,"
Nutriscore, el sistema que informa, usando un algoritmo, de la calidad nutricional de los productos que se venden en las tiendas y los supermercados, ha encumbrado esta semana a una bolsa de basura que asomaba bajo la tapa de un contenedor de la calle Viladomat, en Barcelona.
“Contiene fruta, contiene celulosa y hasta una rata que aporta proteína: todo lo que un niño necesita para crecer”, reza la valoración de Nutriscore, que no tiene en cuenta elementos «subjetivos» como la presentación o lo apetecible del conjunto. «Que los ingredientes son variados es un hecho, y si el Colacao tiene una A, este saco de mierda merece como mínimo la misma nota», señala el experto en comida y basura Roque Paja.
«El algoritmo de Nutriscore considera que el tampón usado de la bolsa contiene hierro y por lo tanto es bueno, no entra en que, a nivel social, nos produzca arcadas», agrega Paja. 
Este especialista señala, además, que «desde el punto de vista de la salud», ingerir «la piel de plátano envuelta en un pañal usado de bebé de tres meses» es mucho más recomendable que comerse una «smash burger». 
La nota de Nutriscore da esperanzas a los servicios de limpieza de la ciudad condal, muy ilusionados ante la posibilidad de que su camión de la basura A-377 gane una Estrella Michelin.
"
El Mundo Today,https://www.elmundotoday.com/2023/02/pues-si-tanto-te-gusta-por-que-no-te-lo-quedas-tu-y-otras-preguntas-pasivo-agresivas-que-hacerle-al-comercial-de-la-inmobiliaria/,2023-02-24,"«Pues, si tanto te gusta, ¿por qué no te lo quedas tú?» y otras preguntas pasivo-agresivas que hacerle al comercial de la inmobiliaria",NUESTROS EXPERTOS TE ASESORAN,1,"
Debido a la demanda tan alta de pisos, los agentes inmobiliarios han dejado de esforzarse al enseñarlos. De hecho, están bastante subiditos. Por eso, lo mejor es comportarse de una manera pasivo-agresiva con ellos, para que te tengan un poco de miedo y acaben decidiendo que lo mejor es alquilarte a ti el piso. A continuación, te mostramos siete preguntas pasivo-agresivas que hacerle al agente inmobiliario para decantar la balanza a tu favor.
Pues, si tanto te gusta, ¿por qué no te lo quedas tú? Esta pregunta es una buena opción para forzar un cambio de poder en la relación. Al hacerla, el interesado en el piso pasa a estar por encima del agente, obligándole a ser más honesto con las prestaciones del inmueble.
¿Hay crema solar para protegerse de toda esta iluminación que dices que hay? Gracias a esta pregunta, el interesado puede conseguir que el agente empiece a exagerar menos las prestaciones del piso y favorezca una comunicación más honesta.
¿Qué pasa, que ya no os quedan pisos buenos? A veces hay que subir un poco el tono para que el agente sepa que tú, como cliente, tienes el poder.
¿Tú sabes quién soy yo? Si el ego del agente le impide cederte el poder, igual hay que usar preguntas un poco más atrevidas para hacerle entrar en razón.
¿Has pensado en lo que te podría pasar si no me alquilas a mí el piso? Si el agente inmobiliario se siente amenazado, es posible que empieces a adquirir cierta ventaja respecto a los otros interesados en alquilar el inmueble.
¿Te pone nervioso que acerque tanto mi cara a la tuya? No es ninguna amenaza, es simplemente una pregunta como otra cualquiera; si nos apuras, te diremos que es una pregunta hasta educada, pues muestra preocupación por el estado del agente inmobiliario.
¿De verdad crees que la policía creería tu versión? Es solo una pregunta, en ningún momento se está aseverando que la policía no fuera a creer la versión del agente, simplemente se está planteando la opción de que quizás no sea así.
"
El Mundo Today,https://www.elmundotoday.com/2023/02/tras-anos-con-fatiga-cronica-descubre-que-se-estaba-poniendo-la-crema-de-noche-durante-el-dia/,2023-02-23,"Tras años con fatiga crónica, descubre que se estaba poniendo la crema de noche durante el día",SE LE CAYÓ CREMA ANTIEDAD EN EL PENE Y AHORA LO TIENE COMO UN NIÑO DE SIETE AÑOS,1,"
Tras años sufriendo fatiga crónica, un hombre ha descubierto que se estaba poniendo la crema de noche durante el día. Xavi Bonet llevaba cinco años con cara de cansado en el trabajo, mientras que se sentía tonificado y fresco como una lechuga en plena madrugada, lo que le provocaba serios problemas para conciliar el sueño.
Después de acudir a numerosos especialistas, que siempre le decían que estaba bien, una mañana se dio cuenta del error. “La piel se me ponía muy bien, pero me entraba un cansancio inmediato”, se sincera. “No caí hasta que me di cuenta de que, durante el desayuno y la ducha previa a echarme la crema, me sentía descansado”, añade. “Me estaba destrozando sin darme cuenta”, dice.
Además del problema con esta crema facial, a Bonet se le cayó hace un mes un poco de crema antiedad en el pene y ahora lo tiene como un niño de siete años. “Se me ha caído hasta el vello púbico, es muy humillante”, explica. “Tengo problemas capilares porque estuve años usando champú para pelo seco sin encender el agua de la ducha”, declara con vergüenza.
El afectado denuncia también que, por culpa del desodorante 24 horas, sus sobacos se han quedado congelados en el tiempo, lo que le provoca sudores fríos.
"
El Mundo Today,https://www.elmundotoday.com/2023/02/zelenski-cree-que-el-falcon-en-el-que-ha-llegado-sanchez-a-ucrania-es-una-donacion-para-su-ejercito/,2023-02-23,Zelenski cree que el Falcon en el que ha llegado Sánchez a Ucrania es una donación para su ejército,LA DIPLOMACIA ESPAÑOLA NO SABE CÓMO ACLARAR LA CONFUSIÓN,1,"
Momentos de confusión e incomodidad los que se han vivido este jueves en Kiev, donde el mandatario español Pedro Sánchez ha aterrizado a bordo de su avión Falcon para entrevistarse con el presidente ucranio, Volodímir Zelenski. El líder ucranio ha elogiado la aeronave de Sánchez y ha reiterado su agradecimiento, insistiendo en que el Falcon 900 «será un activo importante para nuestro ejército».
Por mucho que el español ha recordado que «la aportación de España consiste en carros de combate», Zelenski no ha dejado de replicar «no, pero el avión también nos irá bien, hay que ser fuertes por tierra pero también por aire». Los esfuerzos de la diplomacia española no están dando frutos y varios soldados ucranios han empezado a examinar el avión de Sánchez, tapando la bandera de España que luce el fuselaje con una de Ucrania, confirmándose así que se lo han apropiado.
«Yo en tren no vuelvo», habría avisado el presidente español, que ha exigido «un nuevo Falcon» para él. Desde el Ministerio de Defensa alertan de que «el riesgo de que se mande otra aeronave y se interprete que es otro regalo es demasiado elevado».
«El Falcon es mío, tengo allí mis gafas de sol y mis cosas, me he hecho al asiento y soy presidente, no pienso viajar tantas horas a bordo de una avioneta cutre. Quiero mi Falcon, hablad con quien tengáis que hablar y hacédselo entender a esta gente», habría protestado Sánchez, según fuentes cercanas a su gabinete. «El Air Force One no se lo quedó, ¿no? ¿Por qué se queda con mi avión? Una cosa es ayudar y otra que te tomen el pelo», habría añadido, según las mismas fuentes.
«No perdáis de vista mi cartera, que con la tontería de la guerra este pavo nos deja secos», ha ordenado también Pedro Sánchez.
"
El Mundo Today,https://www.elmundotoday.com/2023/02/nuevo-error-de-renfela-compania-ha-adquirido-ahora-ocho-millones-de-sandwiches-mixtos-que-no-entran-en-la-sandwichera-del-ave/,2023-02-23,Nuevo error de Renfe: la compañía ha adquirido ahora ocho millones de sándwiches mixtos que no entran en la sandwichera del AVE,"""DEFINITIVAMENTE, LA CINTA MÉTRICA QUE TENEMOS ES DEFECTUOSA Y HABRÍA QUE COMPRAR OTRA"", HA ADMITIDO LA MINISTRA DE TRANSPORTES",1,"
El error cometido en el pedido de 31 trenes encargados por Renfe en 2020 para Asturias y Cantabria, y que no caben en algunos de los túneles de la red, ha dado lugar a lo que ya se conoce como uno de los mayores fiascos ferroviarios de los últimos años. Sin embargo, solo unas semanas después, el fallo ha vuelto a repetirse: Renfe ha adquirido millones de sándwiches mixtos que no caben en la sandwichera del vagón restaurante del AVE. 
«No podemos devolverlos y es imposible cocinarlos porque simplemente no entran», ha explicado la ministra de Transportes, Movilidad y Agenda Urbana, Raquel Sánchez.
El fabricante, Panes y Bollos La Polvorosa S.L., ya alertó en marzo de 2021 de que había un error en las medidas del pan de molde, pero sus advertencias fueron ignoradas por el Ministerio de Transportes, Renfe y Adif. «Ahora hay que comérselos sin hacer, o bien intentar forzar el bocadillo para que entre en la plancha, pero es un poco desastre», ha admitido la ministra.
El objetivo ahora es tener listo un nuevo diseño válido de sándwiches en verano para ensamblar los primeros prototipos en otoño. Hasta entonces, la ministra ha admitido que «toca comerse los sándwiches incorrectos» o pensar otra solución.
ACTUALIZACIÓN: el Ministerio de Transportes, Renfe y Adif han acordado la adquisición de 900 nuevas sandwicheras de mayor tamaño que se ajusten a la medida de los 8.0873.475 sandwiches adquiridos. Solución más barata y efectiva que devolver los sándwiches a «Panes y Bollos La Polvorosa S.L.».
ACTUALIZACIÓN: según los ingenieros de Adif, las 900 nuevas sandwicheras adquiridas no caben en el hueco de la encimera de la cocina de los vagones restaurante del Ave.
ACTUALIZACIÓN: el Ministerio de Transportes, Renfe y Adif han acordado la adquisición de 900 nuevas encimeras de mayor tamaño donde sea posible instalar las nuevas sandwicheras.
ACTUALIZACIÓN: según acaban de informar los ingenieros de Adif, las nuevas encimeras adquiridas no caben en el espacio de la barra de los vagones restaurante, por lo que la solución más sencilla es «remodelar por completo los vagones restaurante». 
ACTUALIZACIÓN: el Ministerio de Transportes, Renfe y Adif han informado de que finalmente los vagones restaurante no se remodelarán sino que se adquirirán 900 nuevos ejemplares.
ACTUALIZACIÓN: según acaban de confirmar los ingenieros de Adif, los nuevos vagones restaurante adquiridos por Renfe y Adif no son compatibles con el resto del convoy, por lo que el Ministerio de Transporte, Renfe y Adif han acordado adquirir 900 nuevos trenes de alta velocidad y descartar los viejos, a fin de que los nuevos sí sean compatibles con los nuevos vagones restaurante adquiridos.
ACTUALIZACIÓN: los 900 nuevos trenes de alta velocidad adquiridos por Renfe y Adif no son compatibles ni con el ancho de vía actual del sistema ferroviario español ni con el tamaño de los túneles del mismo.
ACTUALIZACIÓN: el Ministerio de Transportes, Renfe y Adif han acordado (a fin de que los anchos de vía y los túneles sean compatibles con los 900 nuevos convoyes adquiridos y que estos sean compatibles con los vagones restaurante y estos con el tamaño de la encimera de la cocina y estos con las nuevas 900 sandwicheras y estas con los 8.0873.475 mixtos adquiridos) construir de cero todo el sistema ferroviario español y descartar el antiguo.
ACTUALIZACIÓN: el Ministerio de Transportes, Renfe y Adif han confirmado que todo el sistema ferroviario español, tanto el de alta velocidad como el de Cercanías, estará parado hasta 2034.
"
El Mundo Today,https://www.elmundotoday.com/2023/03/el-presidente-chino-reprocha-a-pedro-sanchez-que-aun-no-haya-reformado-la-ley-mordaza/,2023-03-31,El presidente chino reprocha a Pedro Sánchez que aún no haya reformado la Ley Mordaza,NOTICIA PATROCINADA POR AMNISTÍA INTERNACIONAL,1,"
Solo unas horas después de aterrizar en China, en un viaje muy preparado por el Gobierno español, Pedro Sánchez ha sido avergonzado por el presidente Xi Jinping al reprocharle este que aún no haya reformado la Ley Mordaza. «Es vergonzoso que se haya parado la tramitación parlamentaria de la reforma de la Ley Mordaza… es una noticia pésima para los derechos humanos en España y en el mundo», le ha dicho el presidente chino al mandatario español, que no ha sabido qué contestar.
«Chico, que la gente no pueda protestar en España… hombre…», le ha afeado Jinping a Sánchez. El mandatario chino le ha confesado a Sánchez que tenía «reparos morales» para posar en una foto con el representante de un país en el que se limita la libertad de expresión de manifestantes y periodistas.
«Es que ni la Ley de Vivienda… Uf, muchacho, no hay excusas», ha insistido Jinping mientras Sánchez se limitaba a sonreír.
«¿Y lo de Melilla? Ahí ya os cubristeis de gloria», ha llegado a decir Jinping, que aunque es presidente de un país en el que se tienen pocos miramientos con los derechos humanos de la población, considera que «siempre hay alguien a quien afear la conducta».
Según algunos analistas, Jinping se habría estudiado el informe 2022/2023 de Amnistía Internacional, recién publicado, donde se detalla la situación de los derechos humanos en todo el mundo, también en España. Si el presidente español Pedro Sánchez se lo hubiera leído, podría haberle replicado a Jinping que China mantiene la pena de muerte y que, de hecho, lidera el número de ejecuciones anuales en el mundo o que está, por ejemplo, ejerciendo una dura represión contra las personas de la etnia uigur, kazaja y otros grupos étnicos minoritarios.
El presidente chino también ha criticado, delante de Pedro Sánchez, que la actual Ley de Secretos Oficiales de España permita clasificar como “secreta” información sobre violaciones a los derechos humanos. “Cómo os pasáis en España, macho”, ha dicho mirando al presidente español.
"
El Mundo Today,https://www.elmundotoday.com/2023/03/como-hable-yo-sube-el-pan-asegura-el-presidente-de-la-asociacion-espanola-de-la-industria-de-panaderia-bolleria-y-pasteleria/,2023-03-31,"«Como hable yo, sube el pan», asegura el presidente de la Asociación Española de la Industria de Panadería, Bollería y Pastelería","“EN SERIO, QUE CUANDO SUBE EL PAN, HE SIDO YO LITERAL”, INSISTE ESTE PROFESIONAL DEL SECTOR ENCARGADO DE FIJAR LOS PRECIOS DEL PAN",1,"
«Como hable yo, sube el pan», ha asegurado esta mañana el presidente de la Asociación Española de la Industria de Panadería, Bollería y Pastelería. Con estas palabras, Javier Pizarro Gómez intenta morderse la lengua para evitar que el precio del pan se dispare, aunque claramente el presidente tiene ganas de dar su opinión.
La contención de Pizarro se ha hecho extensiva a Nicolás Peroto, presidente de la AITPA, Asociación Industria Textil Algodón, que ha declarado que “Como hable yo, se lía”. De momento, estos profesionales están siendo muy comedidos en sus declaraciones para evitar problemas en la economía española.
Ante las dudas, Javier Pizarro Gómez ha insistido: “En serio, que cuando sube el pan, he sido yo literal”, promete este profesional del sector encargado de fijar los precios del pan. “Yo hablo y sube el pan”, reitera. “Por suerte, uno vale más por lo que calla que por lo que habla”, sentencia.
Por su parte, el portavoz de afectados por la retención urinaria ha asegurado que la situación de todo el colectivo es para mear y no echar gota.
"
