Periódico,Hipervínculo,Fecha publicación,Titular,Subtítulo,Target,Cuerpo
El Mundo Today,https://www.elmundotoday.com/2016/05/femen-obliga-a-sus-activistas-a-agrandarse-los-pechos-para-que-haya-mas-espacio-para-sus-mensajes/,2016-05-27,Femen obliga a sus activistas a agrandarse los pechos para que haya más espacio para sus mensajes,AL FIN PODRÁN ESCRIBIR REIVINDICACIONES DE MÁS DE 140 CARACTERES,1,"Después de comprobar que la sociedad se ha acostumbrado a ver feministas semidesnudas y que su mensaje ha dejado de llamar la atención, Femen ha anunciado que obligará a todas sus activistas a someterse a una intervención de cirugía estética a fin de hacer sus pechos más grandes, llamativos y atractivos “para todas esas personas a las que queremos convencer de nuestra revolución”.
“Así aprenderán todos esos machirulos; la visión de nuestros pechos les hará replantearse todo su sistema de creencias”, insisten las feministas en un comunicado.
En tanto que dueñas de sus cuerpos, las integrantes de Femen creen que pueden hacer uso de ellos como estimen conveniente. “Tenemos mucho que decir y nuestros pechos tienen que dar cabida a estos mensajes”, explica una portavoz de la organización. «Cuanto más grandes y bonitos, más gente se fija en ellos y más sitio tenemos para escribir nuestras reivindicaciones”, reitera.
«Mi cuerpo es mío, es hora de recuperar el poder que nos ha sido negado durante tanto tiempo. Se nos ha borrado de absolutamente todas partes y ahora es el momento de coger el micrófono y empezar a hablar por nosotras mismas. Por eso entendemos que nuestro movimiento tiene que ser construido y promovido por mujeres, aunque eso no quiere decir que no haya hombres en Femen que ayuden. ¡Claro que los hay! Pero nosotras somos las que ideamos las protestas, nuestros debates… El cuerpo, que es disidente al desnudo, sigue siendo el de la mujer. Es nuestro turno de hacer la revolución”, puede leerse en el pecho izquierdo de la primera activista que ya se ha sometido a la operación de agrandamiento de los senos.
Femen también está entrenándose para bailar ‘twerking’, un movimiento que consiste en agitar las caderas de forma sinuosa. Las activistas escribirán “putos” y “hombres” en sus glúteos izquierdo y derecho, respectivamente.
"
El Mundo Today,https://www.elmundotoday.com/2016/05/los-vascos-anaden-una-piedra-al-alfabeto/,2016-05-27,Los vascos añaden una piedra al alfabeto,"ARROJAR UNA PIEDRA QUERRÁ DECIR ""SÍ"" Y ARROJAR DOS QUERRÁ DECIR ""NO""",1,"Los habitantes del País Vasco dispondrán de una letra más en el alfabeto consistente en una piedra que se pronunciará arrojándose contra el interlocutor.
Será la primera letra que no se representará con una grafía sino directamente con un objeto físico, que se pegará con celo o cinta aislante a la representación escrita del alfabeto.
Borja Iturriaga, experto en Euskal Filología de la Universidad de Deusto, ha sido uno de los impulsores de esta nueva incorporación, que persigue «adaptar la lengua de los vascos, que tiene un marcado carácter performativo. Que nos tiramos piedras todo el rato, vaya», explica.
«Tirar una piedra es que sí y tirar dos piedras es que no. La gente lleva tiempo usando este código pero nunca se ha reconocido académicamente», añade el filólogo, que prevé que los vascos acabarán expresándose únicamente con esta nueva letra usando un sistema binario.
Iturriaga plantea también la creación de una Academia de la Lengua en la que los académicos vascos se sienten encima de piedras con su correspondiente letra esculpida en la parte de atrás.
La piedra pasará a formar parte del alfabeto la semana que viene pero los vascos ya lo celebran arrojándosela a la cara unos a otros.
"
El Mundo Today,https://www.elmundotoday.com/2016/05/dios-vende-el-universo-a-una-deidad-menor-y-a-la-mitad-del-precio-de-coste/,2016-05-26,Dios vende el Universo a una deidad menor y a la mitad del precio de coste,NO ERA RENTABLE Y QUERÍA SACARSE EL MUNDO DE ENCIMA LO ANTES POSIBLE,1,"Con la intención de “hacer un poco de sitio” y deshacerse del Universo, Dios, el creador de todas las cosas, ha vendido su creación a una deidad menor por la mitad de lo que le costó hacerlo. “Yo ya no lo uso y prefiero quitármelo de encima aunque pierda dinero”, habría dicho el Altísimo según han informado fuentes del Más Allá y según ha confirmado también el Vaticano.
“Creo que aún funciona, puedes usarlo para probar cosas o como recambio para otros universos”, le ha dicho Nuestro Señor al dios menor que se ha interesado en la compra. El Creador no pensó en ningún momento en que su primera creación fuera “rentable”; de ahí que no le importe perder la inversión y que le interese sacárselo de encima después de seis mil años.
“Este lo hice de prueba y luego hice otro mejor, que es en el que estoy centrado desde hace tiempo”, le ha insistido Dios al comprador. “Era una pena tener este desatendido, por eso le he puesto ese precio tan bajito”.

Desde el Vaticano, han confirmado que la venta es inminente y desconocen si los fieles se verán obligados a seguir adorando al Todopoderoso o al nuevo dios de inferior nivel. “Padre nos ha abandonado, nos ha vendido de segunda mano”, ha confirmado el Papa Francisco. Según el pontífice, hay que disculpar a Dios porque es lógico que quiera centrarse en los otros universos “mejores que el nuestro” y en los que “no existen el mal, las injusticias ni los homosexuales”.
El Cosmos pasa ahora a manos de J’Him Uhgy «el que siempre vigila», una deidad de baja categoría que todavía no ha decidido qué hará con el mundo y los hombres que en él habitan. «Quizá les envío un hijo, por probar», ha declarado según las fuentes.
"
El Mundo Today,https://www.elmundotoday.com/2016/06/marilo-montero-abandona-la-television-por-miedo-a-que-las-camaras-le-arrebaten-el-alma/,2016-06-30,Mariló Montero abandona la televisión por miedo a que las cámaras le arrebaten el alma,"""NO QUIERO SER UN CASCARÓN VACÍO"", ARGUMENTA",1,"Temiendo que las cámaras le arrebaten su “esencia vital”, Mariló Montero ha anunciado en directo el final de su etapa al frente del programa La mañana de La 1 y de su carrera en televisión. «Gracias a TVE, gracias a mis buenos compañeros, aquí concluyo mi ciclo en televisión porque temo que las cámaras me arrebaten el alma para siempre», ha afirmado la presentadora, que ha evitado mirar directamente a las cámaras durante toda la emisión y ha abandonado así la cadena pública después de siete años.
«¿Qué quieren que les diga? Yo no puedo negarles que sentía cierta intranquilidad al saber que las cámaras captaban mi imagen y podían apoderarse de mi espíritu, sinceramente. No está científicamente comprobado, pero nunca se sabe si tu alma se va a quedar atrapada ahí y tú te vas a quedar seca por dentro”, explicaba la presentadora, que teme que su psique acabe recluida eternamente en el interior de uno de los aparatos.
«Los seres vivos poseemos una entidad inmaterial que puede viajar por el aire y llegar a sus hogares, y temo que la mía se agote por completo tras esta etapa maravillosa navegando entre cables y antenas en forma de eco de mi energía vital. Salud y suerte”, ha concluido Montero antes de dar por finalizado el programa. Tras la emisión, según fuentes de TVE, la presentadora ha intentado romper algunos de los monitores del plató para liberar su imagen.
“Me oigo chillar ahí dentro, me estoy secando, necesito que me devolváis mi éter”, habría exclamado.
Antes de abandonar las instalaciones de la cadena, la presentadora quiere asegurarse de que Televisión Española no guarda ninguna copia de sus intervenciones, según han informado fuentes del ente público.
"
El Mundo Today,https://www.elmundotoday.com/2016/06/podemos-no-logra-el-sorpasso-pero-recibe-tres-millones-de-pedidos-de-muebles-de-ikea/,2016-06-30,Podemos no logra el «sorpasso» pero recibe tres millones de pedidos de muebles de Ikea,"""LA CIUDADANÍA NO ENTENDIÓ NUESTRO PROGRAMA"", CONFIRMA ÍÑIGO ERREJÓN",1,"Los resultados cosechados por Unidos Podemos en las elecciones del domingo no fueron los esperados. La coalición no logró adelantar al PSOE y, además, recibió tres millones de pedidos de muebles de Ikea por parte de la ciudadanía.
«La gente no entendió nuestro mensaje ni nuestro programa», ha admitido esta mañana Íñigo Errejón, que cree más que probado que la estrategia de emplear la analogía con un catálogo de Ikea en el programa electoral de Podemos generó confusión entre el electorado.
El propio Pablo Iglesias se ha mostrado sorprendido por los resultados pero ha intentado destacar el lado positivo del asunto: «Los españoles no han confiado en nosotros para asumir las riendas del país pero sí para amueblar sus hogares».
Ahora, el partido tratará de gestionar los tres millones de encargos al considerar que «no podemos fallar a quienes han confiado en nuestras propuestas». Esto obligará a la formación a aparcar los intereses políticos para centrarse en la fabricación y distribución de muebles.
«No descartamos un pacto con Ikea. Hemos iniciado ya una ronda de contactos», ha adelantado Iglesias.
"
El Mundo Today,https://www.elmundotoday.com/2016/06/starbucks-vendera-la-sangre-de-cristo-en-formato-frapuccino/,2016-06-29,Starbucks venderá la sangre de Cristo en formato Frapuccino,NaN,1,NaN
El Mundo Today,https://www.elmundotoday.com/2016/06/crean-un-media-markt-para-clientes-que-si-son-tontos/,2016-06-29,Crean un Media Markt para clientes que sí son tontos,LOS PRODUCTOS COSTARÁN HASTA TRES VECES MÁS,1,"La famosa cadena de tiendas de productos electrónicos Media Markt ha decidido ampliar su oferta con nuevos establecimientos. En concreto, la empresa ha anunciado hoy la apertura de 26 centros en toda España pensados para clientes que sí son tontos.
Según varios estudios de mercado, empeñándose en ser fiel al popular slogan “Yo no soy tonto” la empresa dejaba fuera «a una gran parte de la población, por no decir la mayor parte». De hecho, la compañía recibió varias quejas que intentó subsanar modificando sus carteles: junto a la foto del hombre que afirma no ser tonto, se añadió a otro que decía «Yo un poco sí”. La medida, sin embargo, no era suficiente.
“Consideramos que es justo crear espacios donde los que sí son tontos se sientan identificados, donde se les trate como lo que son: tontos”, argumenta Juan Cantalejo, responsable de la empresa en España.
En los nuevos centros para tontos, los artículos costarán el triple que en los establecimientos habituales, los cajeros se quedarán con las vueltas de las compras y sólo se podrán realizar cambios de productos por otros que cuesten el doble, abonando la diferencia. “Es decir, cosas que sólo un auténtico tonto aceptaría”, en palabras del directivo.
Media Markt inaugurará estos nuevos locales en Navidad y aprovechará para celebrar la Semana Gourmet, en la que se ofrecerán los mismos productos que vende la competencia pero un 30% más caros. «Bastoncillos para las orejas a 70 euros, gorras de propaganda de Caja Rural a 86 euros… todo más caro simplemente porque en el paquete añadimos la etiqueta ‘Gourmet’. Ya hay gente nerviosa preguntándonos si hay lista de espera. Realmente, son muy tontos”, concluye Cantalejo.
"
El Mundo Today,https://www.elmundotoday.com/2016/06/el-camino-de-santiago-inaugura-un-peaje-para-catalanes/,2016-06-29,El Camino de Santiago inaugura un peaje para catalanes,"EL ARZOBISPADO QUIERE ""QUE SE SIENTAN COMO EN CASA""",1,"Con la llegada de las fechas estivales, que traen consigo una mayor afluencia de peregrinos que recorren el Camino de Santiago, los responsables del Arzobispado de la ciudad gallega han decidido inaugurar un peaje para catalanes que han construido en mitad del recorrido.
“Desde la Iglesia siempre hemos intentado que el Camino de Santiago promueva la reflexión y la fe pero también el encuentro y la integración”, explica Amancio Sobredo, sacerdote en la Catedral de Santiago. “Por eso mismo se ha construido el peaje, para que los catalanes se sientan como en casa”, afirma.
Desde primera hora del pasado lunes, los peregrinos catalanes hacen cola para pagar el peaje mientras el resto sigue su ruta sin detenerse.
“Es la primera vez que venimos. Hasta ahora no nos fiábamos porque era gratis”, confiesa Joan Ballet, de 46 años de edad y natural de Santa Coloma de Gramenet. “A mí que me cobren, no quiero favores de nadie”, añade Roser Gispert, esposa de Ballet.
Los responsables del proyecto han mostrado total transparencia a la hora de explicar el uso que se dará a parte del dinero depositado en el peaje. “Financiaremos la construcción de otro peaje. Justo antes de llegar a la catedral”, aclaran. “No es lo mismo ver al Santo después de abonar 8,45 euros que verle a secas. El pago lo hace más emocionante”, aseguran. “Y más si eres catalán, que luego no vas a gastar ni un euro en la ciudad”, añaden.
Otra opción que barajan en la Catedral es cobrar las hostias consagradas a los peregrinos catalanes que asistan a misa. “No están acostumbrados a lo de las tapas gratis, no queremos que se sientan fuera de lugar”, reiteran.
"
