Periódico,Hipervínculo,Fecha publicación,Titular,Subtítulo,Target,Cuerpo
El Mundo Today,https://www.elmundotoday.com/2014/09/artur-mas-confirma-que-la-consulta-se-hara-siguiendo-las-instrucciones-de-ana-pastor/,2014-09-29,Artur Mas confirma que la consulta se hará siguiendo las instrucciones de Ana Pastor,"""CON TAL DE NO OÍRLA, LO QUE SEA"", HA DICHO MAS",1,"Tras visitar el plató de «El Objetivo» de La Sexta y someterse a las preguntas de la periodista Ana Pastor, el presidente de la Generalitat de Cataluña, Artur Mas, acabó concluyendo que la consulta se llevaría a cabo siguiendo, paso a paso, las instrucciones de Pastor. «Y saldrá que no», concluyó Pastor después de convencer a Mas.
«Vale, pues saldrá que no», añadió el político.
«Antes me ha dicho ‘urnas sí’. Pues yo le digo que eso se parece más bien a unas elecciones que a una consulta, como usted la llama. Las cosas se preguntan directamente, bien por teléfono, bien por Facebook, bien por un grupo de Whatsapp», espetó Ana Pastor a Mas cuando él dijo que había establecido un marco jurídico para llevar a cabo el proceso mediante la Llei de Consultes firmada el pasado sábado.
«Bueno, pues lo haremos por teléfono», concluyó Mas. «¿Tiene usted el teléfono de todos los catalanes, señora Pastor? Porque yo no».
«Pues tan unidos no parece que están ustedes para formar un Estado», contestó Pastor a las replicas del líder de CiU. «Bueno, pues haga usted la consulta, ¿qué quiere que le diga? Si tan mal lo estamos haciendo, ¿por qué no pregunta usted a los catalanes?», dijo un rendido Artur Mas.
Durante los últimos diez minutos de la entrevista, Pastor estuvo ayudando a Artur Mas a publicar el evento en Facebook para el próximo 9N.
Durante la mañana de hoy, Artur Mas anunciará que la consulta se llevará a cabo ante las cámaras de «El Objetivo», donde Ana Pastor preguntará uno a uno a todos los catalanes sobre la independencia «con la intención de que cada uno de ellos se explique, si es que puede».
"
El Mundo Today,https://www.elmundotoday.com/2014/09/inditex-abre-un-zara-dentro-de-un-hm/,2014-09-29,Inditex abre un Zara dentro de un H&M,SE LE DERRAMA CAFÉ EN EL SUELO Y CRECE UN STARBUCKS,1,"Esta mañana, los empleados de la tienda de ropa H&M situada en la madrileña calle Orense han abierto las puertas del local y han encontrado dentro del mismo otra tienda de ropa perteneciente a la cadena Zara. 
«Han tomado la sección de ropa infantil y han montado allí un local más grande que el nuestro, desafiando las leyes de la física y del mercado», se queja la supervisora de la franquicia. 
«A los diez minutos, los clientes ya no saben si están en un H&M o en un Zara y la mezcla de los dos hilos musicales les provoca ataques de ansiedad y se vuelven agresivos», explica.
Al ser consultada, la firma Inditex, dueña de Zara, ha confirmado que la operación forma parte de su «plan global de expansión» e insiste en que la compra del local «se ajusta a la legalidad y todo se gestionó con Abundio, el portero del edificio, que dio el visto bueno a cambio de 50 euros y una corbata».
«Esto no vale, joder», han protestado desde Suecia los dueños de H&M. «No descartamos abrir otro H&M dentro del nuevo Zara, a ver quién se cansa primero», ha amenazado H. «Al final habrá más tiendas de ropa que átomos», ha agregado M.
Ayer por la tarde, en Girona, un oficinista derramó un poco de café en el suelo de la calle Mayor y a los diez minutos había crecido un establecimiento de la cadena Starbucks. 
«A mí se me cayeron unas bragas del tendedero y al día siguiente había un Intimissimi», revela otra vecina de la localidad catalana.
"
El Mundo Today,https://www.elmundotoday.com/2014/09/metro-de-barcelona-obligara-a-los-pasajeros-que-se-cuelen-a-cavar-tuneles/,2014-09-26,Metro de Barcelona obligará a los pasajeros que se cuelen a cavar túneles,AYUDARÁN A AMPLIAR LA RED DEL SUBURBANO,1,"Calificando la medida de “compensación justa”, Metro de Barcelona ha admitido esta semana que, desde hace meses, obliga a los pasajeros que viajan sin billete a cavar los nuevos túneles que ampliarán la red de metro de la ciudad.
“Hasta ahora la sanción era monetaria, pero como muchos viajan sin dinero, hemos visto que resulta más satisfactorio para ambas partes pagar en forma de trabajo forzado”, ha explicado un portavoz del suburbano.
“Yo tenía que ir a trabajar y llevo ya tres semanas drenando agua de uno de los túneles inundados, así que voy algo tarde”, ha lamentado una pasajera a la que interceptaron viajando sin billete.
“Vamos cavando hacia adelante y de vez en cuando hacemos que alguien salga a la superficie y vaya golpeando el suelo para saber por dónde vamos; se supone que tenemos que haber llegado al aeropuerto en 2016, aunque yo espero salir antes”, ha explicado un estudiante de 19 años que asegura que solo se ha colado una vez.
“Me compensa cavar túneles porque el billete es un robo”, explica mientras intenta horadar una pared de granito con la carpeta de la Universitat de Barcelona. “Y además creo que estamos cavando en una dirección que me viene de paso: cuando hayamos llegado a la facu, empiezo a cavar para arriba y aquí se quedan”.
«Si lo llego a saber, cavo el túnel desde mi casa hasta la universidad directamente, porque la parada de metro me queda más lejos», ha concluido.
El Ayuntamiento ha declinado informar sobre cuánto tiempo se considera que un pasajero debe estar trabajando para el suburbano para compensar el hecho de viajar sin billete (infracción penalizada hasta ahora con 50 euros de multa). “Están cavando el tiempo que están cavando, dependiendo de la dureza del terreno y de la resistencia de cada cual”, dicen desde el despacho de Ada Colau.
"
El Mundo Today,https://www.elmundotoday.com/2014/09/la-dgt-anima-a-acorralar-y-destruir-a-todos-los-conductores-que-lleven-la-ele/,2014-09-26,La DGT anima a «acorralar y destruir» a todos los conductores que lleven la «ele»,"PROHIBIRÁN LA PEGATINA ""BEBÉ A BORDO"" PORQUE ""A NADIE LE INTERESA TU VIDA PRIVADA""",1,"La Dirección General de Tráfico (DGT) ha presentado hoy un decálogo de buena conducta para los automovilistas en el que recomienda «acorralar y destruir, en la medida de lo posible, a los conductores que lleven la ‘ele'». 
Van muy lentos, molestan, son tontos y ponen de los nervios
Tráfico considera que los novatos son «una lacra, un estorbo y un peligro» para el resto de conductores, puesto que acostumbran a circular a muy baja velocidad y de forma errática. 
«Lo típico es verles y decir en voz alta ‘Ya está, ya me ha tocado el idiota delante como siempre’, pero la cosa no pasa de ahí. Pedimos un mayor grado de implicación a los conductores para que, al encontrarse con un novato, lo insulten y lo persigan hasta apartarlo totalmente de la carretera», explica un portavoz de la entidad. «No podemos pretender que las autoridades se encarguen solas de apartar la basura de las carreteras. Es un tema de civismo», añade.
La DGT aconseja a los conductores experimentados que no se dejen engañar por el aspecto de los automovilistas noveles, «que suelen ser jovencitos y en apariencia vulnerables». Los expertos recuerdan que «coger el coche no es obligatorio, y menos si no tienes ni puta idea de conducir. Es un acto de egoísmo salir a la carretera sin saber y pretender que la gente aguante tus torpezas solo porque llevas una pegatina que dice que eres gilipollas».
Las autoridades se están planteando además la prohibición de la pegatina «Bebé a bordo» porque los coches que la llevan incitan a los demás conductores a bajarse del automóvil para ver a la criatura y hacerle monerías. «Ayer mismo se produjo un atasco monumental en la M-30 porque había más de veinte personas haciendo cola para acariciar a un crío que se supone que era monísimo», explica el portavoz de la DGT. 
«Está muy bien que la gente tenga niños pero tampoco hace falta alardear de ello por ahí, y más teniendo en cuenta que hay otros conductores que igual no pueden tener hijos y se sienten ofendidos», argumenta la DGT.
"
El Mundo Today,https://www.elmundotoday.com/2014/09/el-autocorrector-del-movil-cambia-oye-bonita-por-mira-zorra/,2014-09-25,"El autocorrector del móvil cambia «oye, bonita» por «mira, zorra»",NaN,1,EtiquetasAndroidautocorrectorcomunicaciónlenguajeLo mejor de 2014móvilmóvilesWhatsapp
El Mundo Today,https://www.elmundotoday.com/2014/09/becario-no-remunerado-muere-por-sobredosis-de-prestigio/,2014-09-25,Becario no remunerado muere por sobredosis de prestigio,NaN,1,EtiquetasbecarioscreatividadcreativoscrisisempresaLo mejor de 2014monopatínmuerteoficinaprecariedadprestigiopublicidadtrabajo
El Mundo Today,https://www.elmundotoday.com/2014/09/por-que-se-dobla-nuestro-iphone-6/,2014-09-25,¿Por qué se dobla nuestro iPhone 6?,PODRÍA DEBERSE A UNA SINGULARIDAD ESPACIO TEMPORAL,1,INICIAR SESIÓN
El Mundo Today,https://www.elmundotoday.com/2014/09/pantene-se-rinde-con-tu-pelo-de-mierda/,2014-09-24,Pantene se rinde con tu pelo de mierda,NaN,1,EtiquetasbellezabragascabelloestéticaFairylenceríaLo mejor de 2014PantenepeloPro-VitaminasVileda
El Mundo Today,https://www.elmundotoday.com/2014/09/rajoy-recorre-las-calles-en-busca-de-un-nuevo-ministro-de-justicia/,2014-09-24,Rajoy recorre las calles en busca de un nuevo ministro de Justicia,"BUSCA A ALGUIEN DURO, VENGATIVO Y LLENO DE FURIA JUSTICIERA",1,"Tras la noticia de la dimisión de Gallardón, Mariano Rajoy ha cancelado todas las citas de su agenda para recorrer los bajos fondos preguntando por «tíos duros y vengativos» que se vean capaces de asumir el cargo de ministro de justicia. «La clase de hombre que busco para este trabajo debe buscarse en el asfalto, en los callejones, en las cunetas de la ley», ha explicado Rajoy a la prensa.
«Busco a alguien a quien no le tiemble el pulso, ¿sabes lo que te digo?», le preguntó anoche el jefe del Ejecutivo a Jimmy «el encías» Stranson, el tabernero que regenta el bar de caballeros «El Serrucho», frecuentado por hampones y policías retirados. «Haz correr la voz, encías», le volvió a decir Rajoy, según han confirmado diversos testigos.
«¿Eres tú capaz de administrar justicia y manejar a los jueces a tu antojo? No, no lo creo. No aguantarías ni dos días en el ministerio», le dijo Rajoy a uno de los parroquianos que le preguntó por las condiciones del trabajo. Posteriormente, tal y como han comentado las mismas fuentes, Rajoy le echó el humo del puro en la cara y salió del bar tratando de encontrar «a alguien que sepa castigar e indultar como quien respira o come o folla».
«No busco a un hombre bueno, busco a uno capaz de saltar de un lado a otro de la ley», ha dicho Rajoy
«Cuando el miedo realmente te golpea tienes que permanecer en pie, saber que la ley eres tú», explicó el presidente español a diversos periodistas que le preguntaron por el futuro del Ministerio de Justicia.
«Busco a la clase de hombre que te mira de lejos y sabe si eres culpable o no, cuyo aspecto sea duro y recio como una cantera de granito que alguien acaba de dinamitar», subrayó el mandatario.
«Busco a alguien que sepa que la justicia y la ley son extrañas compañeras de cama. Un día te acuestas con una y otro día con otra. Pero, maldita sea, mejor que no tontees con las dos a la vez: son unas putas muy celosas, amigo», añadió el presidente.
«Y encontrar a ese hombre es algo que debo hacer solo», concluyó para luego perderse en la jungla urbana.
"
El Mundo Today,https://www.elmundotoday.com/2014/09/los-fetos-espanoles-lloran-la-marcha-de-gallardon-y-protestan-con-energicas-patadas/,2014-09-24,Los fetos españoles lloran la marcha de Gallardón y protestan con enérgicas patadas,LA DIMISIÓN LES HA SENTADO FETAL,1,"Desde que el ministro de Justicia, Alberto Ruiz-Gallardón, presentara ayer su dimisión y anunciara que abandona la política tras el fracaso de su anteproyecto de reforma de la ley del aborto, las embarazadas españolas han experimentado molestias provocadas por la agitación de sus fetos.
«En las ecografías, los fetos aparecen levantando el puño de forma reiterada y, cuando se cansan, se tapan las orejas con los bracitos y balancean la cabeza arriba y abajo como diciendo ‘No puede ser'», explica un ginecólogo del hospital Gregorio Marañón de Madrid. En las paredes de algunos úteros se han detectado también pintadas y garabatos supuestamente antiabortistas. 
Unos trillizos han formado una cadena humana
Según confirman médicos de varios centros hospitalarios del país, un gran número de nonatos españoles ha formado un lazo con el cordón umbilical en señal de duelo. «Los que aún no tienen bracitos y no pueden protestar, se limitan a tragar líquido amniótico y a escupirlo luego con fuerza», añade una enfermera.
Especialmente reseñable ha sido el acto de protesta de unos trillizos de Zamora, que han formado una cadena humana para mostrar su apoyo a Gallardón. «Solo cesan las patadas cuando me meto en una iglesia», explica su madre.
Los médicos, además, coinciden al certificar un aumento de los partos prematuros. «Tienen prisa por salir y liarla por lo que les han hecho», argumentan los expertos, que aconsejan a los padres que se mantengan alejados de la actualidad informativa. «Mi niño ha nacido llorando por lo de Gallardón. Le han tenido que dar la vuelta y calmarle con palmadas en el culo», lamenta una madre.
Tras varias horas de acampada en el útero, muchos de los bebés nacen sucios y cansados, requiriendo la intervención de los facultativos. 
Al cierre de la edición, el Ministerio del Interior del Útero ha amenazado con someter a las embarazadas a inyecciones intracitoplasmáticas de espermatozoides antidisturbios. 
"
El Mundo Today,https://www.elmundotoday.com/2014/10/parar-a-ronaldo/,2014-10-31,Parar a Ronaldo,VIÑETA 31/10/2014,1,INICIAR SESIÓN
El Mundo Today,https://www.elmundotoday.com/2014/10/el-jefe-de-apple-presenta-una-nueva-sexualidad-mas-fina/,2014-10-31,El jefe de Apple presenta una nueva sexualidad más fina,NaN,1,NaN
El Mundo Today,https://www.elmundotoday.com/2014/10/hacienda-contrata-a-iker-jimenez-para-que-investigue-sociedades-fantasma/,2014-10-31,Hacienda contrata a Iker Jiménez para que investigue sociedades fantasma,"""A VECES DAN GOLPES Y NOS PERCATAMOS DE QUE ESTÁN AHÍ, OCULTAS"", ASEGURA EL PRESENTADOR",1,"La Agencia Tributaria ha anunciado hoy el fichaje del periodista y experto en fenómenos paranormales, Iker Jiménez, para reforzar la lucha contra el fraude fiscal.
«¿Hay sociedades fantasma realizando operaciones comerciales por valor de hasta 130.000 millones en un mundo más allá del fisco? ¿Es un fraude? Escuchemos la voz de los expertos y, luego, que cada cual saque sus propias conclusiones», ha declarado Iker Jiménez a los periodistas.
El presentador cree que «hay dinero que de repente desaparece y no sabemos cómo. Simplemente, se esfuma». «¿Es posible que siga presente de alguna manera en otra realidad lejana a la nuestra? ¿Podemos invocarlo o se ha perdido para siempre en un paraíso?», añade.
El periodista está convencido de que hay empresas que mueren pero siguen influyendo en el mundo de las finanzas bajo otros nombres sin que los inspectores de Hacienda puedan seguir su rastro. «Esos fantasmas a los que Hacienda no detecta a veces dan golpes y es entonces cuando nos percatamos de que están ahí», ha explicado. «¿Debemos perseguirlos o es mejor que no perturbemos su paz?», se pregunta.
El responsable de «Cuarto Milenio» asegura que, cuando ha intentado desvelar la verdad de ciertas sociedades secretas, se le han empezado a cerrar puertas misteriosamente. «Normalmente, los implicados nunca recuerdan nada. No saben nada. Es como si se les hubiera borrado la memoria», dice.
Jiménez también se ha mostrado muy inquieto por la probable existencia de «agujeros de miles de millones en los que quedan atrapados de por vida algunos contribuyentes». 
"
El Mundo Today,https://www.elmundotoday.com/2014/10/gerard-pique-acusa-de-impostor-a-un-joven-que-llevaba-una-camiseta-del-barca-con-su-nombre/,2014-10-30,Gerard Piqué acusa de impostor a un joven que llevaba una camiseta del Barça con su nombre,NaN,1,EtiquetasCarrefourestafaFútbol Club BarcelonaGerard PiquéinvestigaciónIron MaidenLo mejor de 2014MercadeanPolicía Nacionalsuplantación de identidad
El Mundo Today,https://www.elmundotoday.com/2014/10/canibal-ecologista-lamenta-que-los-humanos-de-hoy-en-dia-ya-no-saben-a-nada/,2014-10-30,Caníbal ecologista lamenta que los humanos de hoy en día ya no saben a nada,"""NO ESTÁN CRIADOS EN LIBERTAD Y ESO SE NOTA"", DENUNCIA",1,"Tras comprobar que la calidad de la carne humana ha ido empeorando poco a poco, Antonio Esprido, un caníbal de Madrid, ha alertado esta mañana mediante un comunicado de que “las personas de hoy en día ya no saben a nada” y ha aconsejado “volver a métodos tradicionales de crianza y recuperar el sabor auténtico del canibalismo”.
“Les dan mierdas para que engorden lo antes posible”, ha lamentado Esprido, asegurando que la carne humana de hoy en día, “al menos la que se encuentra por ahí en los supermercados o en la calle o en el metro», es insípida y está adulterada.
“Es todo química hoy en día”, ha añadido.
Esprido dice tener “ciertos principios morales” que le impiden seguir consumiendo humanos que “se han pasado la vida encerrados y sin ver la luz del sol, atiborrándose de antibióticos”. “Hace años devorabas cruda a cualquier chica a la que hubieras engañado para que subiera a casa y veías que ahí había sabor y salud y alimento”, dice.
«La Logse ya hizo que le perdiera el gusto a los sesos rebozados”, concluye, solicitando “que se les permita comer mejor, que lleven una mejor vida, en libertad, para que podamos luego devorarlos en crudo tras perseguirles durante horas por calles oscuras, porque algunos ya tienen las piernas atrofiadas por la vida recluida que llevan”.
"
El Mundo Today,https://www.elmundotoday.com/2014/10/pablo-iglesias-presenta-su-coleta-de-invierno/,2014-10-29,Pablo Iglesias presenta su coleta de invierno,MUDA DOS VECES AL AÑO,1,"Tras unos días en los que se ha recluido para hacer la muda de otoño, la cara más visible de Podemos, Pablo Iglesias, ha presentado esta mañana su coleta para la temporada invernal: una mata de pelo más apropiada para el frío, algo más grande y que se bifurca en varias colas permitiéndole rodear su cuello, según han informado fuentes cercanas a la formación política.
Asegura que es un pelo muy español, «como de jineta o borreguito»
«Cada seis meses se repite el mismo ritual: primero luzco una coleta en su máximo esplendor, como muy altiva, y luego se me cae de golpe”, explicaba Iglesias esta mañana durante la presentación de su nuevo pelaje. “Y al cabo de unos días ya me ha crecido de nuevo. La de invierno es cálida y reconfortante, ideal para las manifestaciones bajo la lluvia”, ha agregado.
«Me gusta pensar que la barba de Marx tenía la misma textura», ha añadido, invitando a los periodistas a acariciársela. El político ha tildado su coleta invernal de «majestuosa» pero asegurando que «no por ello se aleja de la calle o de la gente».
Iglesias ha asegurado no entender la «atención mediática» que despierta su coleta, «especialmente si tenemos en cuenta que Gallardón lucía siempre sus cejas de invierno y nadie decía nada». Ha defendido también que en Podemos «al menos sabemos renovarnos y amoldarnos al clima». Tras la presentación, Iglesias ha empezado a gritar sus consignas de apareamiento, dando por iniciada la temporada de celo de la izquierda.
"
El Mundo Today,https://www.elmundotoday.com/2014/10/un-experimento-con-ratones-revela-que-los-ratones-se-dejan-hacer-de-todo/,2014-10-29,Un experimento con ratones revela que los ratones se dejan hacer de todo,SOPORTAN INSULTOS E INDIRECTAS CON PASMOSA INDIFERENCIA,1,"Tras dos años experimentando con ratones de laboratorio «y haciéndoles hacer de todo», un equipo de científicos de la universidad californiana de Stanford ha concluido que estos animales tienen mucha paciencia y son «unos buenazos».
El objetivo principal de la investigación era, precisamente, comprobar hasta dónde llega el aguante de los roedores, que han resultado ser muy resistentes a los insultos. «En una primera fase, probamos con una cepa de descalificaciones de intensidad media-baja, gritándoles cosas como ‘capullo’, ‘tontorrón’ o ‘tu madre es una rata’. Ninguno de ellos afectó a su estabilidad física y emocional», explica uno de los científicos.
Luego, en una segunda fase, los insultos fueron más fuertes -«Cara de culo», «Maricón de playa» o «Hijo de la gran puta»- pero tampoco lograron burlar las defensas psicológicas de los animales.
Sorprendidos, los investigadores empezaron a trabajar en el plano del acoso físico, dando empujones a los ratones, soplándoles en la cara o mirándoles fijamente mientras les decían «Tú qué, ¿eh? ¿A ti qué te pasa, subnormal?». Todos los resultados fueron negativos.
«Fue asombroso descubrir que su mecanismo de defensa estaba provocando desánimo en nosotros. Es decir: su completa indiferencia minaba nuestra capacidad de ataque. Algunos compañeros abandonaron el estudio diciendo que estábamos haciendo el chorra. De haber prolongado más tiempo el experimento, los ratones se habrían librado completamente del ataque a su organismo», declara el jefe del estudio. «Después de dos años, empiezas a sentir un poco de vergüenza cuando piensas que has dedicado tanto tiempo y dinero a molestar a unos ratones que no te hacen caso. Se puede decir que han ganado ellos», añade.
Ahora, el reto de los científicos es experimentar con humanos a los que poder implantar el potencial defensivo de los roedores. «No va a ser fácil porque nuestras estructuras físicas y mentales son distintas. A dos de nuestros colaboradores les han partido la cara esta mañana en el metro», relata el investigador.
Tras presentarse los resultados del estudio, la portavoz en España de la protectora de animales PETA, Dolores Parmalat, ha recomendado a los científicos que se metan con alguien de su tamaño, como por ejemplo «un mastín del Pirineo».
"
El Mundo Today,https://www.elmundotoday.com/2014/10/la-gaviota-del-partido-popular-emigra-ante-los-casos-de-corrupcion/,2014-10-28,La gaviota del Partido Popular emigra ante los casos de corrupción,HA PARTIDO RUMBO A SUIZA ESTA MISMA MAÑANA,1,"Levantando con furia el ala derecha hasta alzar el vuelo rumbo a Suiza, la emblemática gaviota del Partido Popular ha abandonado la formación esta mañana abrumada, según los etólogos, por los múltiples casos de corrupción política que han salido a la luz pública estos últimos días.
«Se le ha visto el plumero», apuntaba el socialista Pedro Sánchez, insinuando que el animal no tiene las alas limpias. «El clavel se ha puesto tan encendido que está quemando mi piel», ha añadido refiriéndose al símbolo del PSOE.
La versión oficial de los populares sostiene que este tipo de animales aprovecha el tiempo invernal para desplazarse hacia otras latitudes. «Podemos asegurar que no tiene nidos en Suiza», asegura la formación en su página web.
Los populares esperan que la pérdida del ave -la más relevante desde la muerte de Manuel Fraga- sea temporal y culpan a los periodistas de haberla asustado tocándole demasiado los huevos.
«Suerte tienen de que no sea un loro porque a estas alturas ya lo habría cantado todo», sentenciaba esta mañana el líder de Podemos, Pablo Iglesias, en la presentación oficial de su coleta otoño/invierno.
"
El Mundo Today,https://www.elmundotoday.com/2014/10/esperanza-aguirre-abandona-su-forma-humana-para-pasar-desapercibida-tras-la-detencion-por-corrupcion-de-su-exnumero-dos/,2014-10-28,Esperanza Aguirre abandona su forma humana para pasar desapercibida tras la detención de su exnúmero dos,NaN,1,EtiquetasAliencorrupcióncorrupción en el PPCreative CommonsEsperanza AguirreextraterrestresLo mejor de 2014PP
