Periódico,Hipervínculo,Fecha publicación,Titular,Subtítulo,Target,Cuerpo
El Mundo Today,https://www.elmundotoday.com/2022/02/una-persona-claramente-idiota-todavia-no-tiene-una-opinion-formada-sobre-el-conflicto-belico-que-ha-estallado-hace-ya-varias-horas/,2022-02-24,Una persona claramente idiota todavía no tiene una opinión formada sobre el conflicto bélico que ha estallado hace ya varias horas,HA TENIDO SIETE HORAS PARA ENTENDER EL CONFLICTO Y APARENTEMENTE TODAVÍA NO LO HA ENTENDIDO PORQUE NO TIENE UNA OPINIÓN SÓLIDA,1,"
Pese a que son ya más de las doce del mediodía y Rusia ha atacado a Ucrania hace más de siete horas, tiempo más que suficiente para procesar absolutamente toda la información al respecto, Ramón Palenciano, un administrativo de 47 años, todavía no ha publicado en su cuenta de Twitter un solo análisis geopolítico, lo que indica que es claramente una persona ignorante incapaz de formarse opiniones sólidas y contrastadas. “Vaya gilipollas, seguramente no sabe qué pensar porque no ha dicho nada cuando todos los demás tenemos clarísimo qué está ocurriendo”, afirma una fuente cercana a Palenciano que ha concluido que este es, muy posiblemente, incapaz de pensar por sí mismo y de llegar a conclusiones.
“Es un tema complejo, así que 15 minutos sin opinar son comprensibles, ¿pero seis horas? Vaya imbécil”, reitera esta fuente.
Palenciano, que debe de ser analfabeto, parece que aún no sabe qué pensar sobre las auténticas intenciones que tiene Vladímir Putin con Ucrania ni tampoco sobre cómo va a afectar el conflicto bélico a las bolsas europeas. “Quizá sufre algún tipo de retraso, porque todos los demás ya sabemos si apoyamos a la OTAN o no y también si hay que sospechar o no de China”, dice otra fuente cercana a Palenciano, muy preocupada por el silencio de este, que ni siquiera se ha pronunciado sobre el tipo de sanciones que se le deben imponer a Rusia.
A última hora, el imbécil de Ramón Palenciano ha publicado un tuit opinando, con 48 horas de retraso (lo que indica que es muy lento y que ha necesitado leer demasiado para formarse una opinión), sobre la crisis interna del Partido Popular.
"
El Mundo Today,https://www.elmundotoday.com/2022/03/ayuso-ficha-a-ortega-cano-como-vocal-del-centro-de-asuntos-taurinos-tras-descartarlo-como-chofer/,2022-03-31,Ayuso ficha a Ortega Cano como vocal del Centro de Asuntos Taurinos tras descartarlo como chófer,NaN,1,INICIAR SESIÓN
El Mundo Today,https://www.elmundotoday.com/2022/03/bruce-willis-deja-hollywood-para-empezar-su-carrera-en-espana-tras-ser-diagnosticado-con-una-enfermedad-que-afecta-al-habla/,2022-03-31,Bruce Willis deja Hollywood para empezar su carrera en España tras ser diagnosticado con una enfermedad que afecta al habla,EL ACTOR ESTADOUNIDENSE PROTAGONIZARÁ TODAS LAS PELÍCULAS QUE SE HAGAN EN ESPAÑA,1,"
En el día de ayer, Bruce Willis anunció que deja Hollywood para empezar su carrera en España tras ser diagnosticado con una enfermedad que afecta al habla. El actor estadounidense considera que sus problemas para vocalizar y para hablar en alto lo convierten en el candidato idóneo para protagonizar películas producidas en nuestro país.
La industria española ya espera a Bruce Willis con los brazos abiertos. “Tenemos a nuestros mejores guionistas escribiendo diálogos para que Bruce los interprete sin que se entienda nada de lo que dice”, expresan desde la Academia de Cine. “La idea es seguir haciendo el mismo cine de siempre pero ahora contando con una estrella internacional”, añaden.
Bruce Willis protagonizará todas las películas que se hagan en España porque ahora mismo es perfecto para todos los papeles. Algunos productores están pensando en hacer remakes de algunas películas ya estrenadas porque consideran que los actores que las interpretaban susurraban poco y vocalizaban demasiado. 
Ahora, la industria de cine español espera el milagro de que alguna actriz de la talla de Bruce Willis sufra también algún problema parecido que afecte a su habla para poder contar con los dos en las películas.
"
El Mundo Today,https://www.elmundotoday.com/2022/03/el-telescopio-hubble-descubre-una-estrella-lejana-en-la-que-no-se-habla-de-la-bofetada-de-will-smith/,2022-03-31,El telescopio «Hubble» descubre una estrella lejana en la que no se habla de la bofetada de Will Smith,EL SONIDO DE LA BOFETADA TARDARÁ 200 AÑOS EN LLEGAR ALLÍ,1,"El telescopio espacial Hubble ha descubierto esta semana la estrella más lejana que se ha observado: Earendel, un astro al menos 50 veces más grande que el sol y con una temperatura de unos 20.000 grados, que está a 12.900 millones de años luz y en la que no se habla de la bofetada de Will Smith ni se discute sobre los límites del humor, el machismo o el uso de la violencia.
«El sonido de la bofetada de Will Smith tardará aún 200 años en llegar allí», explica el experto Martín Socas, que lamenta no poder viajar hasta esa estrella para disfrutar de un entorno libre de la polémica de la semana. «Mentalmente podemos imaginarnos en esa estrella remota, quizá logramos unos minutos de paz, pero parte de la gracia de Earendel es que no hay nadie, y es porque no hay nadie que no se habla de la bofetada de Will Smith», explica Socas.
El astro explotó hace millones de años, «quizá por otra polémica», estiman los astrónomos, pero el Hubble ha podido captar su luz ahora. «La estrella no se libra de la violencia tampoco, no te creas, pero al menos no hay chiste de por medio ni machismo», razona Martín Socas.
Aunque la NASA ha prohibido a los astronautas que se encuentran en estos momentos fuera de la Tierra que discutan lo ocurrido en la ceremonia de los Oscar, no se ha podido evitar que la bofetada de Will Smith atraviese la atmósfera y propague la polémica por el espacio sideral.
"
El Mundo Today,https://www.elmundotoday.com/2022/03/pedro-sanchez-asegura-que-no-eliminara-la-filosofia-sea-lo-que-sea-eso-de-los-planes-de-estudio/,2022-03-31,"Pedro Sánchez asegura que no eliminará la Filosofía, «sea lo que sea eso», de los planes de estudio","""REFLEXIÓN, POEMAS, COSAS SENSIBLES, ROLLO ARTÍSTICO... TODO ESTO VA A ESTAR, SEÑORÍAS"", HA PROMETIDO",1,"
El presidente del Gobierno, Pedro Sánchez, garantizó ayer en el pleno del Congreso que «los niños y niñas» de España «van a estudiar Filosofía, sea lo que sea la cosa esa». Insistió el mandatario en que «todo lo que sean movidas de pensar y tal, de ideas y temas profundos, formará parte de la educación básica, como no puede ser de otra manera».
Sánchez afeó al presidente de Vox, Santiago Abascal, que hubiera difundido un bulo según el cual esta disciplina iba a ser eliminada por el Gobierno. «Usted que sabe tanto de cosas de esas, tenga cuidado con la desinformación, porque yo ni siquiera sabía que estaba la Filosofía, así que es imposible que la haya quitado», sentenció el presidente.
«Filosofía, reflexión, poemas, cosas sensibles, rollo artístico… todo esto va a estar, señorías, se lo aseguro», reiteró Sánchez. «Ningún español saldrá del colegio sin saber lo que es un platón, son cosas fundamentales y profundas de la reflexión de la persona», agregó.
«Los niños y las niñas de nuestro país serán tanto o más raciocinios que los del resto de Europa», prometió Sánchez para terminar.
"
El Mundo Today,https://www.elmundotoday.com/2022/03/guardan-el-cuscus-que-ha-sobrado-en-un-taper-sabiendo-que-nadie-se-lo-comera-jamas/,2022-03-31,Guardan el cuscús que ha sobrado en un táper sabiendo que nadie se lo comerá jamás,"NO ES LA PRIMERA VEZ QUE M.G. Y C.C., QUE PREFIEREN MANTENERSE EN EL ANONIMATO, VIVEN ESTA SITUACIÓN",1,"Las autoridades afirman que la pareja tiene tendencia a cocinar con demasiada hambre y como consecuencia “calculan mal”, viéndose obligados a guardar las sobras para no sentirse culpables por tirar comida e intuyendo a su vez que nadie se comerá nunca el contenido de ese táper.
Según la investigación, que se inició cuando un familiar dio la voz de alarma al descubrir que el cuscús llevaba dos semanas en el frigorífico, M.G. y C.C. ya tenían antecedentes con un táper de pasta que congelaron a finales de los 90 y que todavía sigue ahí. “No lo vamos a tirar por si un día nos apetece”, se defendía la pareja en un testimonio recogido por este medio.
El portavoz de la familia aseguraba esta mañana que “es probable que las siguientes generaciones tengan que lidiar con este problema tomando decisiones desagradables, como ingerir alimentos congelados desde hace décadas o tirarlos a la basura, aun sabiendo que el 10% de la población mundial se encuentra en situación de pobreza extrema”.
Por otra parte, en palabras de la propia pareja, “hay gente pasando hambre y tirar la comida es una irresponsabilidad, pero tampoco esa gente se va a comer esto en concreto”.
Las redes sociales no han tardado en reaccionar tras conocer la noticia acusando a los protagonistas de “equidistancia”, ya que no han tomado ninguna decisión con respecto al táper y esto es “una cobardía digna del primer mundo”, clamaba Twitter esta mañana con el hashtag #otelocomesolotiras.
La pareja ha pedido respeto ante la situación y, sobre todo, empatía, porque “mañana también te puede pasar a ti”, declaraban mientras se disponían a hervir cuatro paquetes de pasta “por si acaso no llega”.
"
El Mundo Today,https://www.elmundotoday.com/2022/03/el-90-de-los-funcionarios-echa-de-menos-su-etapa-como-opositor/,2022-03-31,El 90% de los funcionarios echa de menos su etapa como opositor,NaN,1,NaN
El Mundo Today,https://www.elmundotoday.com/2022/03/el-emerito-se-niega-a-declarar-ante-el-juez-en-reino-unido-porque-esta-convencido-de-que-lo-violaran/,2022-03-30,El emérito se niega a declarar ante el juez en Reino Unido porque está convencido de que lo violarán,"""RECORDARLE A UNO QUE NO ES INVIOLABLE ES, DE FACTO, UNA AMENAZA DE VIOLACIÓN"", ARGUMENTA SU DEFENSA",1,"
El magistrado Matthew Niklin, del Tribunal Superior de Inglaterra y Gales, estableció el pasado jueves que las leyes británicas no recogen la inviolabilidad de don Juan Carlos I. La defensa del rey emérito ha reaccionado esta semana anunciando que el acusado «se abstendrá de visitar Reino Unido para declarar ante el juez al considerar que se le ha amenazado directamente con violarlo».
Don Juan Carlos I se niega, pues, a sentarse en el banquillo por las acusaciones de acoso procedentes de su antigua amante, Corinna Larsen, si es que finalmente es citado por un juez británico. Los abogados del emérito se agarran a su interpretación de las palabras de Niklin, que insisten en tildar de «amenaza directa de agresión».
«Si a usted le recuerdan que no es inviolable, ¿qué entiende? Le están diciendo lo que piensan hacerle», ha comentado el propio emérito esta mañana, acusando a la justicia británica de «apoyar la cultura de la violación».
Al cierre de la edición, Su Alteza Real doña Sofía de Borbón ha recordado que lleva años viviendo en Londres y nadie la ha violado.
"
El Mundo Today,https://www.elmundotoday.com/2022/03/una-persona-muy-lejos-de-haber-tenido-exito-asegura-que-el-exito-no-le-ha-cambiado/,2022-03-30,Una persona muy lejos de haber tenido éxito asegura que el éxito no le ha cambiado,"“LA FAMA VIENE Y VA”, INSISTE ESTE INDIVIDUO QUE NUNCA HA ROZADO LA FAMA",1,"
Presumiendo de ser el mismo de siempre, esta mañana un individuo que está muy lejos de haber tenido éxito ha asegurado que el éxito no le ha cambiado. Enrique Cabestrillo Cabrales, de 32 años, se siente orgulloso por haber mantenido siempre los pies en la tierra, ignorando el hecho de que nunca le ha pasado nada que pudiera haberlos hecho despegar lo más mínimo.
“La clave es rodearte de los amigos de siempre, que ellos sean el pegamento que te mantiene en la realidad”, ha explicado a unos amigos que le han visto fracasar una y otra vez en todos sus intentos de alcanzar sus metas. Aunque el riesgo de que se le suba el éxito a la cabeza es nulo porque nunca ha tenido el más mínimo reconocimiento de nadie, Enrique está muy orgulloso de seguir siendo el mismo de siempre, ignorando quizá el hecho de que eso, entre otras cosas, es lo que le impide alcanzar el éxito.
“La fama viene y va”, insiste este individuo que nunca ha rozado la fama. “Un día estás arriba y al siguiente estás abajo”, añade este hombre que nunca ha estado arriba. “El dinero, las mujeres y los lujos te pueden despistar, por eso en mi situación hay que andarse con cuidado”, dice obviando que no tiene dinero, que las mujeres no se fijan en él y que su mayor lujo es un iPhone 6 de segunda mano.
Finalmente, Enrique ha querido agradecer a todos los que le han ayudado a llegar al lugar en el que se encuentra ahora mismo, como si hubiera llegado a algún sitio. “Sin ellos todavía sería ese joven lleno de ilusiones que luchaba por cumplir su sueño”, ha dicho este adulto iluso que lucha por cumplir un sueño absolutamente irrealizable.
"
El Mundo Today,https://www.elmundotoday.com/2022/03/los-gemidos-de-una-vecina-recuerdan-a-una-pareja-la-existencia-del-sexo/,2022-03-30,Los gemidos de una vecina recuerdan a una pareja la existencia del sexo,"“OSTRAS, EL SEXO, ¿TE ACUERDAS DE ESO? ¿CÓMO SE HACÍA? MOLABA”, HA COMENTADO LA PAREJA CON NOSTALGIA",1,"
Ayer a las 23:50 horas de la noche, los gemidos de la vecina de arriba recordaron a una pareja la existencia del sexo. Inicialmente la pareja reaccionó a los gemidos con sorpresa y confusión, pero tras varios minutos escuchándolos recordaron que hace años ellos también llegaron a emitir gemidos semejantes en la práctica de algo que conocían como sexo.
A medida que los gemidos se fueron haciendo más sonoros, los recuerdos de la pareja se intensificaron. “Yo me ponía así encima, tú abrías las piernas y pasábamos un rato bastante bueno, ¿no?”, preguntaba Joaquín Cantero, de 37 años. “¿Puede ser que incluso alguna vez hiciésemos algo parecido en el sofá y dejásemos a la mitad una serie?”, trataba de recordar Gertrudis Fernández.
Tras un rato conversando, la pareja llegó a la conclusión de que el sexo era algo que les gustaba. “Ostras, el sexo, ¿te acuerdas de eso? ¿Cómo se hacía? Molaba”, ha comentado la pareja con nostalgia sin entender cuándo ni por qué dejaron de practicarlo. “Al principio lo hacíamos todo el rato, es verdad”, afirmó Gertrudis con una mezcla de nostalgia y pereza.
Afortunadamente, en cuanto los gemidos del piso de arriba cesaron, los dos miembros de la pareja pudieron seguir mirando cada uno su móvil en la cama hasta dormirse.
"
El Mundo Today,https://www.elmundotoday.com/2022/03/los-filosofos-espanoles-protestaran-por-la-eliminacion-de-la-filosofia-de-la-eso-cuando-hayan-probado-su-propia-existencia/,2022-03-30,Los filósofos españoles protestarán por la eliminación de la Filosofía de la ESO cuando hayan probado su propia existencia,"""SI FINALMENTE SE CONFIRMA QUE EXISTIMOS, DAREMOS LA BATALLA"", PROMETEN",1,"El Consejo de Ministros ha aprobado este martes el proyecto de real decreto de la ESO, que da luz verde a la desaparición de la Filosofía. Esta misma mañana, varias asociaciones de filósofos han prometido plantar cara a la decisión en cuanto hayan probado su propia existencia. «Sentadas las bases de una epistemología blindada contra los argumentos escépticos, es decir, cuando estemos seguros de que la ESO y el Gobierno existen, de que nosotros mismos existimos, daremos la batalla porque esta decisión es intolerable», comenta Alba Iglesias Martín, catedrática experta en Teoría del Conocimiento de la Universidad de Barcelona, que prefiere no confirmar su testimonio «hasta que mis presupuestos ontológicos sean irrefutables».
«¿Existo? No lo sé. ¿Me parece bien la medida del Gobierno? Si es real, me parece fatal», señala Iglesias. Insiste esta pensadora en que «si el mundo es real, nadie querrá vivir en esa realidad en la que los alumnos no reciben una formación básica que les dé herramientas para dudar de lo que les rodea como estoy haciendo yo ahora mismo».
Los filósofos españoles no descartan que este país en el que se maltrata sistemáticamente su disciplina sea una creación de su mente, una proyección de sus miedos. «Ya es casualidad que, siendo yo filósofa, viva en un mundo en el que mi profesión es deliberadamente ninguneada. Suena a paranoia alimentada por miedos infantiles. Vamos, que es razonable dudar de que esto esté pasando. Y si encima tenemos en cuenta que estoy haciendo unas declaraciones para El Mundo Today… en fin, los motivos para poner todo esto en entredicho son sólidos», argumenta Iglesias.
La tentación de los filósofos de concluir que esta realidad que los ignora no existe es cada vez mayor, pues la obligación de afrontarla y aprender a vivir en ella les resulta ya insoportable.
"
El Mundo Today,https://www.elmundotoday.com/2022/03/esta-pelicula-hay-que-verla-en-pantalla-grande-dice-un-joven-refiriendose-a-la-pantalla-del-televisor-y-no-a-la-del-movil/,2022-03-29,"«Esta película hay que verla en pantalla grande», dice un joven refiriéndose a la pantalla del televisor y no a la del móvil","""LLAMADME PURETA PERO ES LO QUE PIENSO"", DEFIENDE EL CINÉFILO",1,"
«Llamadme pureta, pero para apreciar los matices de Padre no hay más que uno 2: La llegada de la suegra hay que verla como mínimo en tableta o televisor», argumentaba esta mañana Tomás Vega Moralejo, un joven cinéfilo que considera que la calidad de algunos filmes no puede apreciarse en pantallas pequeñas y es necesario verlas «tal y como el director las concibió», es decir, en la pantalla de un televisor o de una tableta.
Vega reconoce que «no todo el mundo tiene tiempo para sentarse a ver una película en la tele, porque siempre tenemos series a medias, y sé que una peli es ideal para verla en el metro». Sin embargo, cree que algunas obras sí merecen un pequeño sacrificio. «Incluso en la tele de la cocina captas matices que en el móvil, mientras estás cagando, se te escapan», razona.
Sobre la posibilidad de ver películas en el cine, opción en la que este joven no había caído porque «es un hábito de gente mayor», argumenta Tomás Vega que «es cierto que la oscuridad de la sala permite ver mejor la pantalla del móvil, pero el ruido de los altavoces del propio cine impide que oigas bien la película incluso si pones el volumen del móvil al máximo».
"
El Mundo Today,https://www.elmundotoday.com/2022/03/pedro-sanchez-abofetea-a-inigo-errejon-por-llamar-calvo-a-carmen-calvo/,2022-03-29,Pedro Sánchez abofetea a Íñigo Errejón por llamar “calvo” a Carmen Calvo,"“MANTÉN EL NOMBRE DE MI DIPUTADA FUERA DE TU PUTA BOCA”, LE HA GRITADO EL PRESIDENTE DESDE SU ESCAÑO",1,"
Mañana muy movida la que se ha vivido hoy en el Congreso de los Diputados. Poco después de que Íñigo Errejón, presidente de Más País, iniciara su intervención en el estrado, Pedro Sánchez se ha levantado de su escaño, ha caminado hacia el diputado y le ha propinado una bofetada por llamar “calvo” a Carmen Calvo.
Tras la agresión, el presidente volvió a su sitio visiblemente enfadado mientras Errejón permanecía en shock. “El presidente de España acaba de darme una bofetada en toda la cara”, ha dicho provocando las risas de los demás representantes de la ciudadanía, que en ese momento pensaban que era una broma preparada.
“Solo me he referido a la señora Calvo por sus declaraciones sobre la ópera y los toros”, se ha defendido Errejón desde el estrado. “Mantén el nombre de mi diputada fuera de tu puta boca”, le ha gritado el presidente desde su escaño hasta en dos ocasiones. “Está bien, está bien”, ha respondido Errejón tratando de zanjar el asunto. “Esta es la mañana más histórica del Congreso de los Diputados desde el 23F”, ha añadido el líder de Más País antes de finalizar su alocución.
La agresión vivida en el Congreso ha generado mucha disparidad de opiniones. En Vox han aplaudido al presidente por primera vez desde que empezó su legislatura, en el PSOE han justificado la agresión apelando a que el comentario de Errejón estaba fuera de lugar, el Partido Popular ha exigido la dimisión de Sánchez y Unidas Podemos ha pedido que se erradique la palabra “calvo” de la lengua española.
"
El Mundo Today,https://www.elmundotoday.com/2022/03/horoscopo-de-la-semana-leo-nadie-se/,2022-03-29,"Horóscopo de la semana: Leo, nadie se pegará por ti aunque tengas el pelo graso y las puntas abiertas",NaN,1,NaN
El Mundo Today,https://www.elmundotoday.com/2022/03/paleontologos-afirman-que-la-ausencia-de-huellas-en-la-region-del-africa-meridional-indica-que-los-dinosaurios-usaban-lejia-estrella/,2022-03-28,Paleontólogos afirman que la ausencia de huellas en la región del África Meridional indica que los dinosaurios usaban lejía Estrella,"“O LEJÍA O QUIZÁ TAMBIÉN CALCETINES”, MATIZAN LOS EXPERTOS",1,"
Tras décadas buscando rastros de vida por la zona sin éxito, esta semana varios paleontólogos han llegado a la conclusión de que la ausencia de huellas en la región del África Meridional indica que los dinosaurios usaban lejía Estrella. Después de muchos análisis, los expertos han establecido que esa es la única explicación lógica a la falta de rastros de estos animales en el lugar.
“Aunque los saurópsidos no disponían de pulgares oponibles, sí podían usar los dientes para desenroscar el bote y luego limpiar el suelo”, explica Judit Mancho, experta en palentololejía. “Seguramente cogían la fregona entre dos ejemplares y entonces borraban las huellas”, añade. “Pero claro, al borrar las huellas, pues no hay huellas, y entonces es imposible demostrar que eso pasara”, se sincera. “Pero eso no quita que haya pasado”, concluye.
Otra teoría que se baraja en la comunidad de paleontólogos defiende que los dinosaurios utilizaban calcetines, aunque no se ha encontrado ninguno porque los calcetines se pierden muy rápido. “Todos perdemos calcetines constantemente, así que es imposible que ahora encontremos unos de hace millones de años”, defiende Mancho, que también es especialista en calcetines. “Es de sentido común”, insiste.
Aunque la teoría de los calcetines es difícil de rebatir, la mayoría de los paleontólogos considera que es la de la lejía la correcta, pues en toda la historia de la paleontología todavía no se ha encontrado ni una sola camisa amarillenta que perteneciera a un dinosaurio.
"
El Mundo Today,https://www.elmundotoday.com/2022/04/teologos-confirman-que-jesucristo-era-dequeista/,2022-04-29,Teólogos confirman que Jesucristo era dequeísta,"""DEJAD DE QUE LOS NIÑOS SE ACERQUEN A MÍ"", HABRÍA DICHO EN UN INCORRECTO ARAMEO",1,"
Un estudio comandado por Sebastian Brilsh, profesor emérito en arameo de la Universidad de Oxford, junto con un grupo de teólogos del Vaticano expertos en el análisis de la Biblia, ha llegado a la conclusión de que el hijo de Dios incurría habitualmente en el uso incorrecto de la preposición «de» delante de oraciones subordinadas completivas introducidas por la conjunción «que». Un vicio que, trasladado al español, se conoce como «dequeísmo». 
El informe de los especialistas, hecho público esta mañana, lleva a reformular algunas sentencias célebres de Jesucristo para adecuarlas a la realidad histórica: «Dejad de que los niños se acerquen a mí» sería la más llamativa, pero también destacan otros ejemplos como «Deje de que el que está entre ustedes que está sin pecado sea el primero en arrojar una piedra» o «Sabe de que estoy contigo siempre; sí, hasta el final de los tiempos».
«Jesucristo no era tonto», se ha apresurado a aclarar Brilsh en la presentación de los resultados. «El dequeísmo no tiene nada que ver con la capacidad intelectual, lo que demuestra es que Cristo era un hombre, con sus virtudes y sus defectos, una persona del pueblo», subraya.  Niega además que el dequeísmo «por sí solo» fuera motivo suficiente para crucificarlo, «y más en aquella época en la que no había Twitter».
En España, la Real Academia de la Lengua ha insistido en que «hay que evitar el dequeísmo incluso si es obra de dios», y ha recordado que «el que quiera hablar mal el arameo, que lo haga, pero el español no admite el uso incorrecto de las preposiciones». Hay miedo, sin embargo, entre la comunidad académica, de que los creyentes adopten ahora el dequeísmo para sentirse más cerca del Señor. «¿Está bien dicho lo de ‘hay miedo de que’? ¿Qué habría dicho Jesús?», se pregunta ahora este redactor. Con la norma en la mano, no se trata de un dequeísmo y por tanto es correcta la expresión, pero si Jesucristo lo hubiera dicho de otra manera… ¿no habría que seguir su ejemplo? Esperemos de que pronto se llegue a un consenso.
"
