Periódico,Hipervínculo,Fecha publicación,Titular,Subtítulo,Target,Cuerpo
El Mundo Today,https://www.elmundotoday.com/2021/09/diaz-ayuso-logra-contarle-a-joe-biden-el-proyecto-de-la-piramide-azteca-en-un-pasillo-de-100-metros-de-largo/,2021-09-27,Díaz Ayuso logra contarle a Joe Biden el proyecto de la pirámide azteca en un pasillo de 100 metros de largo,ASEGURA LA PRESIDENTA QUE LE HA SOBRADO PASILLO,1,"La presidenta de la Comunidad de Madrid, Isabel Díaz Ayuso, ha dado este domingo el pistoletazo de salida a su viaje de siete días por Estados Unidos. Hoy mismo, la gira se ha considerado ya amortizada cuando, recién llegada a Washington D. C. desde Nueva York, Ayuso ha podido coincidir con el presidente norteamericano Joe Biden en un pasillo durante una visita turística a la Casa Blanca y, en solo 20 segundos, ha sido capaz de ponerle al corriente del proyecto de construcción de una pirámide azteca en Madrid promovido por el artista Nacho Cano.
«Creo que se ha hecho un lío al final con lo de la pirámide y se ha pensado que era mexicana, pero bueno, la realidad es que, en la mitad de tiempo que el señor Sánchez, he hecho el doble por Madrid y por tanto por España y por todos los españoles», ha sentenciado con satisfacción la presidenta.
El equipo de Ayuso insiste en que el encuentro con Biden no ha sido «un mero saludo como el del señor Sánchez» y defiende, de hecho, que ha tenido lugar una «reunión bilateral» en toda regla. El acierto de Ayuso, siempre según sus colaboradores, ha sido saltarse precisamente la parte del saludo protocolario e ir al grano. «Teníamos aún menos pasillo que Sánchez, no podíamos perder el tiempo y la presidenta ha sabido estar a la altura abriendo fuego con una pregunta directa: ‘Do You Know Mecano?'», explica el entorno de Ayuso. Esas primeras palabras han captado, al parecer, el interés de Biden «a diferencia del señor Sánchez, que en 30 largos segundos no pasó de la simple conversación de pasillo».
Díaz Ayuso asegura que le ha sobrado pasillo y que al final del recorrido ha tenido que hablar del tiempo porque ya estaba todo dicho.
"
El Mundo Today,https://www.elmundotoday.com/2021/10/un-meteorito-cae-sobre-la-tierra-y-mata-al-dinosaurio-que-hizo-el-discurso-en-la-onu/,2021-10-29,Un meteorito cae sobre la Tierra y mata al dinosaurio que hizo el discurso en la ONU,NaN,1,INICIAR SESIÓN
El Mundo Today,https://www.elmundotoday.com/2021/10/quitadnos-el-chocolate-si-quereis-pero-no-la-filosofia-suplican-al-gobierno-los-ninos-espanoles/,2021-10-29,"“Quitadnos el chocolate si queréis pero no la Filosofía”, suplican al Gobierno los niños españoles","TEMEN ADEMÁS QUE SE PROHÍBA LA PROSTITUCIÓN PORQUE ""EL SEXO ES EL SUSTITUTO NATURAL DEL CHOCOLATE""",1,"
Duro mazazo para la infancia en España. Esta semana, el Ministerio de Consumo ha anunciado que prohibirá la publicidad de chocolatinas, dulces y helados dirigida a menores con el objetivo de reducir notablemente su ingesta. Pero, además, se ha sabido que la asignatura de Filosofía desaparecerá de la oferta de optativas de la ESO con la aplicación de la Lomloe (Ley Orgánica para la Mejora de la Calidad Educativa). Esta segunda amenaza ha puesto a los niños en pie de guerra.
«Podemos prescindir del chocolate, pero no vemos cómo apañárnoslas sin la capacidad de emitir juicios sintéticos a priori. Necesitamos también herramientas argumentativas para combatir el relativismo imperante, defender la existencia de ‘lo real’ ante postulados idealistas extremos o al menos ser capaces de distinguir el ‘ser-en-sí’ del ‘ser-para-sí'», comenta Pedro Soriano, de nueve años de edad. «Mis hermanos me vacilan diciéndome que un genio maligno me engaña y que mi realidad no es real y yo no sé qué contestar», protesta.
Los niños, pues, consideran que el Gobierno los ha dejado en la estacada. «Sin pensamiento crítico nos abandonaríamos a una vida irreflexiva, frívola y dedicada a los placeres mundanos, pero cómo se supone que se hace esto sin chocolate ni dulces», se pregunta Soriano.
Los menores se muestran preocupados también por la intención de abolir la prostitución, pues consideran que el sexo es el sustituto natural del chocolate. «Alguna alternativa nos tienen que dar», insisten.
"
El Mundo Today,https://www.elmundotoday.com/2021/10/dentro-de-nada-estamos-en-navidad-anuncia-el-proximo-nobel-de-astrofisica/,2021-10-29,"«Dentro de nada estamos en Navidad», anuncia el próximo Nobel de Astrofísica","“PUES YA HEMOS CENADO”, DIJO EL AÑO PASADO, REVOLUCIONANDO EL SECTOR CULINARIO",1,"
Después de meses de investigación, Arturo Campanelo, de 62 años, ha revolucionado el mundo de la ciencia al descubrir que “dentro de nada estamos en Navidad”. Este anuncio lo sitúa en una posición muy aventajada para hacerse con el próximo Nobel de Astrofísica. El genio español comunicó ayer su hallazgo a su mujer y a sus hijos mientras estaba sentado tranquilamente en el salón de su casa.
Primero Campanelo estableció el día exacto en el que caerá Navidad y, tras señalar el día que es hoy, realizó un complejo cálculo mental con el que consiguió llegar a la conclusión de que la celebración católica está realmente cerca en el tiempo. “Parecía que quedaba mucho, pero Arturo ha demostrado que el tiempo es relativo y que en nada estaremos comiendo junto a nuestros seres queridos”, señala la comunidad científica.
En las pasadas Navidades, Campanelo ya revolucionó el sector culinario al asegurar “Pues ya hemos cenado” apenas unos segundos después de acabar de cenar. Ya son famosas sus postulaciones sobre termodinámica, especialmente cuando afirma, en un día todavía otoñal, que “parece que refresca”.
Muchos científicos aún recuerdan cuando este hombre, esta eminencia, sentenció “ya estamos todos”, reformulando las bases de la estadística para siempre y aportando un enfoque clave para los expertos en demografía. O su célebre “Esto es como todo”, con el que cambió drásticamente la percepción mundial de la lógica.
"
El Mundo Today,https://www.elmundotoday.com/2021/10/cinco-claves-para-distinguir-a-los-ninos-que-vienen-a-pedir-caramelos-a-tu-casa-por-halloween-de-unos-ladrones/,2021-10-29,Cinco claves para distinguir a los niños que vienen a pedir caramelos a tu casa por Halloween de unos ladrones,NUESTROS EXPERTOS TE ASESORAN,1,"
Halloween ya está aquí y, como es una celebración relativamente nueva en España, es normal que los propietarios e inquilinos de viviendas todavía tengan dudas a la hora de entender sus códigos. Por eso nuestros expertos de Idealista te dan cinco claves para distinguir a los niños que vienen a tu casa a pedir caramelos de unos ladrones.
Los niños van disfrazados de ladrones. Si los niños van disfrazados de ladrones, con armas, pasamontañas y midiendo casi dos metros, es probable que no sean niños y realmente se trate de ladrones.
Vives en España y no en Estados Unidos, así que ningún niño va a las casas en Halloween. Si vives en Albacete, Ourense o Barcelona, lo normal es que las personas que llamen a tu timbre sean ladrones porque no vives en Estados Unidos, no eres estadounidense y nunca lo serás.
Cuando les preguntas si son ladrones se sonrojan y se ponen nerviosos. Si algo caracteriza a los ladrones es su honestidad. Si les preguntas si son ladrones y se ponen nerviosos y se sonrojan, claramente son ladrones y no niños.
En lugar de caramelos te piden joyas y dinero. Si en lugar de “truco o trato” te dicen “arriba las manos, esto es un atraco”, lo más probable es que estés ante una banda de ladrones y no ante unos niños hambrientos de dulce.
Los niños te han atado y amordazado en el desván. Si estás atado junto a tu familia en el desván, seguramente esos niños son unos ladrones profesionales y no están celebrando Halloween.
"
El Mundo Today,https://www.elmundotoday.com/2021/10/que-tipo-de-companero-de-piso-eres-segun-tu-personalidad/,2021-10-28,¿Qué tipo de compañero de piso eres según tu personalidad?,PATROCINADO POR FRIPOZO,1,
El Mundo Today,https://www.elmundotoday.com/2021/10/filtrado-un-audio-de-florentino-perez-lleno-de-elogios-a-koeman/,2021-10-28,Filtrado un audio de Florentino Pérez lleno de elogios a Koeman,"TAMBIÉN CONFIESA QUE ECHA MUCHO DE MENOS ""A NOBITA""",1,"
«Es la persona que más feliz me ha hecho en la vida». Así de entusiasmado se muestra el presidente del Real Madrid, Florentino Pérez, hablando sobre Ronald Koeman en una conversación privada que se ha filtrado a los medios esta tarde. «Ha hecho más por el club que ningún otro entrenador», se le oye aseverar.
Los audios han trascendido poco después de que el Barça haya despedido a su entrenador. Koeman no ha querido pronunciarse sobre las declaraciones de Pérez pero ha negado con la cabeza cuando se le ha preguntado si cree que tiene posibilidades de incorporarse al club blanco. «No va por ahí», se ha limitado a decir.
El directivo del Real Madrid se ha mostrado muy disgustado hoy y no está claro si el motivo del enfado es la filtración de la conversación privada o la destitución de Koeman. «Todo lo bueno se acaba», ha comentado al respecto.
Al cierre de la edición, ha trascendido otro audio de Florentino Pérez en el que confiesa que echa mucho de menos «a Nobita».
"
El Mundo Today,https://www.elmundotoday.com/2021/10/abandonar-a-la-pareja-y-a-los-hijos-y-adoptar-una-nueva-identidad-a-2000-kilometros-de-distancia-es-la-manera-mas-sencilla-de-hacer-una-mudanza-segun-los-expertos/,2021-10-28,"Abandonar a la pareja y a los hijos y adoptar una nueva identidad a 2000 kilómetros de distancia es la manera más sencilla de hacer una mudanza, según los expertos",IRSE CON LO PUESTO PERMITE AHORRAR HASTA 3000 EUROS EN LA MUDANZA,1,"
¿Tienes que hacer una mudanza? Déjalo todo atrás y cambia de vida. Esta es la conclusión a la que han llegado docenas de expertos en logística, que coinciden en que empezar una nueva vida de cero es, a la larga, «más fácil, práctico y barato» que organizar una mudanza. «Cambiar de pareja es duro, pero hay que asumir que la mayoría de mudanzas generan tanta tensión en las relaciones que estas acaban rompiendo igualmente», explica Jaime Moreno, que lleva 30 años al frente de Mudanzas Moreno.
«Mover dos toneladas de ajuar que luego no encajará en la nueva residencia y que finalmente habrá que tirar a la basura para adquirir nuevo mobiliario, con sus correspondientes y difíciles viajes a Ikea, es muchísimo más caro que salir a la calle y, simplemente, dejarlo todo atrás», explica Moreno, que recuerda que lo mejor es dejar atrás todas las posesiones personales «y caminar, caminar lejos, lejos, lejos, todo lo lejos que se pueda, donde nadie sepa nuestro nombre».
Así, el abandono del hogar se confirma como la forma más eficiente de gestionar un cambio de hogar.
Javier Segura, un español que hace tres años tuvo que enfrentarse a un cambio de piso, lo hizo saliendo de casa con lo puesto y no volviendo la visa atrás, y se muestra tajante: «No sé de quién me habláis, no he oído hablar jamás de Javier Segura, yo me llamo Juan González», ha declarado.
"
El Mundo Today,https://www.elmundotoday.com/2021/10/una-familia-madrilena-aterrada-ante-la-posibilidad-de-que-la-lava-del-volcan-de-la-palma-llegue-a-su-chale-de-las-rozas/,2021-10-28,"Una familia madrileña, aterrada ante la posibilidad de que la lava del volcán de La Palma llegue a su chalé de Las Rozas",HAN PEDIDO A SU SERVICIO QUE VAYA EMPAQUETANDO LOS ARTÍCULOS MÁS VALIOSOS,1,"
Viendo que la lava del volcán de La Palma sigue expandiéndose y está cada vez más cerca, la familia madrileña Sesma-Agaj vive aterrada ante la posibilidad de que acabe sepultando su chalé de Las Rozas. Tanto el matrimonio como sus once hijos exigen a las autoridades que hagan algo. “No podemos seguir viviendo así”, denuncian. “Necesitamos la certeza de que el volcán no va a destruir nuestra casa porque la reformamos el año pasado”, añaden.
A esta familia le parece tercermundista tener que estar pendiente de si un volcán destruye sus pertenencias. “Me parece increíble que en pleno 2021 sigan pasando estas cosas en España”, se sincera Cayetana Sesma Agaj, de 16 años. “Cómo le explico yo a mis hijos pequeños que hay un volcán acercándose a su habitación”, pregunta la madre. “Espero que la Comunidad de Madrid o el Ayuntamiento hagan algo porque, si tenemos que esperar al Gobierno, lo tenemos crudo”, expresa el padre.
Por si acaso, la familia ya ha pedido a su servicio que vaya empaquetando los artículos más valiosos. “Tenemos objetos de muchísimo valor que no se pueden dañar, nosotros tenemos mucho más que perder que los canarios”, explican desde su chalé de Las Rozas. “Es muy duro vivir con este miedo”, reconocen.
Esta familia ya vivió un auténtico calvario cuando se produjo el tsunami de Tailandia en el año 2004. “Tuvimos que cubrir nuestra piscina porque sentíamos que en cualquier momento ocurriría una auténtica desgracia”, declaran.
"
El Mundo Today,https://www.elmundotoday.com/2021/10/desalojan-el-oceano-atlantico-porque-un-nino-orino-en-el-agua/,2021-10-28,Desalojan el océano Atlántico porque un niño orinó en el agua,LA TEMPERATURA HA SUBIDO UN GRADO Y SE TEME QUE PROVOQUE CAMBIOS CLIMÁTICOS IRREVERSIBLES,1,"
Salvamento Marítimo ha vivido hoy una de las jornadas más ajetreadas que se recuerdan. Rafael Candau, un niño vigués, ha orinado en la playa de Samil y ha obligado a desalojar todo el océano Atlántico. Bañistas de todo el mundo, barcos y hasta los trabajadores de las plataformas petrolíferas han tenido que abandonar el agua a la carrera.
El orín del niño se extendió esta mañana a gran ritmo por el mar y acabó sembrando el pánico generalizado. “Me estaba bañando tranquilamente y noté una corriente caliente a la altura de mi cadera”, relata un bañista de la costa argentina. Salvamento Marítimo lleva horas desalojando el océano esperando a que la orina se acabe disolviendo. “Son solo unas gotitas, no hay de qué preocuparse”, ha intentado tranquilizar el presidente de la Junta de Galicia, Alberto Núñez Feijóo, en la línea de Mariano Rajoy.
Además de la insalubridad que provoca el orín en el agua, su presencia ha elevado la temperatura del océano un grado y ahora se teme que el niño haya provocado cambios climáticos irreversibles. “Ha sido la gota que ha colmado el vaso, ese niño se ha cargado todo el equilibrio climático”, lamentan desde Greenpeace.
No es la primera vez que el pequeño Candau, conocido como El Pispa, provoca daños irreparables en el planeta Tierra. El año pasado ya rompió la pantalla del televisor de sus padres de un balonazo, provocando el desalojo inmediato de todos los trabajadores de RTVE.
"
El Mundo Today,https://www.elmundotoday.com/2021/10/un-grupo-de-amigos-sigue-riendose-del-que-invirtio-todos-sus-ahorros-en-criptomonedas-pese-a-que-ahora-es-multimillonario-y-vive-en-nueva-york/,2021-10-27,Un grupo de amigos sigue riéndose del que invirtió todos sus ahorros en criptomonedas pese a que ahora es multimillonario y vive en Nueva York,"“MIRA, MIRA EL PRINGAO DE MANEL, QUE SALE EN LA LISTA FORBES. ¡QUÉ VERGÜENZA!”, COMENTAN BURLONES",1,"
Sin dejar de considerarlo un pesado y un «auténtico flipado», un grupo de amigos sigue riéndose del compañero que invirtió todos sus ahorros en criptomonedas pese a que ahora es multimillonario y vive en Nueva York. “Menudo ingenuo, este va a perder todo su dinero”, se ríen ignorando el hecho de que su amigo Manel ha quintuplicado su patrimonio en los dos últimos años y ahora tiene un piso de propiedad en Manhattan.
“Claro que sí, Manel, claro que sí, ahora mismo invertimos en Ripple”, bromean los amigos desde su Lleida natal mientras Manel duerme en su ático de la Gran Manzana. “El pobre se ha comido esto de las criptos como quien se come una estafa piramidal”, se sinceran los amigos. “Siempre ha sido muy ingenuo, hasta un poco tonto si me lo permites”, añaden.
Manel, de 37 años, ya no sabe cómo decirle a sus amigos que, con un poco de investigación e inversión, es fácil generar beneficios en el volátil mercado de las criptomonedas. “Sí, sí, ya si eso cuando tengas un Ferrari nos lo explicas de nuevo, campeón”, le vacilan sus amigos, pasando por alto el hecho de que Manel adquirió un Ferrari 812 Competizione hace cuatro meses. “Mira, mira el pringao de Manel, que sale en la lista Forbes, qué vergüenza”, comentan entre risas sujetando la portada de la revista.
Al grupo de amigos de Manel en el fondo le preocupa que en cualquier momento le dé con otra cosa y siga haciendo el ridículo. “Hoy son las criptos pero igual mañana se lanza con el turismo espacial y vuelve a provocarnos vergüenza ajena”, declaran sin saber que Manel ha invertido ya en una nave espacial que prevé aterrizar en Marte en el año 2035.
"
El Mundo Today,https://www.elmundotoday.com/2021/10/dos-de-cada-tres-espanoles-hechos-a-si-mismos-estan-mal-hechos/,2021-10-27,Dos de cada tres españoles hechos a sí mismos están mal hechos,LOS EXPERTOS ACONSEJAN NO HACERSE UNO MISMO SI NO SE SABE MUY BIEN LO QUE SE ESTÁ HACIENDO,1,"Aunque comúnmente se percibe como meritorio que un individuo se haya hecho a sí mismo, formándose como persona con sus propios recursos, generalmente escasos, y sin apenas ayuda de nadie, un estudio de la Universidad Complutense de Madrid presentado esta semana señala que la mayoría de los españoles que declaran haberse hecho a sí mismos están mal hechos.
«Es un error congratularse de haber prescindido de ayuda externa, de profesionales, y describir como un logro algo que a veces deja mucho que desear y que, generalmente, es deficiente», sentencia Jose Antonio Grande, uno de los expertos que firma el estudio. «Ser una mierda de persona no es bueno aunque te hayas hecho a ti mismo, este matiz no le añade valor, al contrario, demuestra cierta negligencia», agrega el especialista.
La investigación atribuye a «cierto estereotipo social basado en perfiles idealizados de autosuperación» esta buena prensa que tienen las personas hechas a sí mismas. «Suelen esconder traumas y graves carencias y, además, el orgullo de no haber necesitado a nadie nunca hace difícil que se presten a escuchar consejos de otros», señala Grande.
La investigación admite que «españoles bien hechos no hay muchos, incluso tienen defectos los que han contado con ayuda y posibilidades». Pero, precisamente por eso, dicen los expertos, «si encima se prescinde de ayuda, el resultado es desastroso».
El informe añade también otro dato sorprendente: pensar por uno mismo es, según confirman los especialistas, una forma absurda de perder el tiempo para acabar llegando, si ha habido suerte, a las mismas conclusiones que ya obtuvieron sabios del siglo IV antes de Cristo.
"
El Mundo Today,https://www.elmundotoday.com/2021/10/la-falta-de-productos-de-electronica-obligara-a-millones-de-personas-a-pensar-regalos-personales-para-sus-seres-queridos/,2021-10-27,La falta de productos de electrónica obligará a millones de personas a pensar regalos personales para sus seres queridos,NaN,1,INICIAR SESIÓN
El Mundo Today,https://www.elmundotoday.com/2021/10/el-villano-del-pueblo-se-frota-las-manos-al-saber-que-angel-gabilondo-es-el-nuevo-defensor-del-pueblo/,2021-10-26,El Villano del Pueblo se frota las manos al saber que Ángel Gabilondo es el nuevo Defensor del Pueblo,GABILONDO AÚN SE PREGUNTA SI SU NUEVO CARGO ES COMPATIBLE CON LIDERAR LA OPOSICIÓN EN MADRID,1,"Desde que el Gobierno y el PP llegaron a un acuerdo hace unos días para nombrar a Ángel Gabilondo como nuevo Defensor del Pueblo, el Villano del Pueblo se pasea con aires de suficiencia por España, dispuesto a poner a prueba las aptitudes de su nuevo rival. «Creo que voy a privatizar el pueblo, a ver qué hace. Probablemente, nada», ha declarado el villano esta misma mañana.
La Defensoría del Pueblo permanecía en funciones desde 2017, debido al cambio de Gobierno y la posterior negativa del PP para alcanzar un acuerdo que permitiese la renovación. Todo este tiempo, el villano ha campado a sus anchas, favoreciendo la despoblación de las zonas rurales, cuyos habitantes estaban hartos de la falta de autoridad. Ahora, con Gabilondo defendiéndoles, la situación es peor porque el Villano del Pueblo se ha envalentonado. «Qué risas con la señora Ayuso, que lo conoce bien. ‘Hazle esto, hazle lo otro… pero ya verás que ni se entera’, me decía la tipa», ha declarado el villano.
Gabilondo lleva días valorando si su nuevo cargo de Defensor del Pueblo es compatible con seguir liderando la oposición en la Asamblea de Madrid. «Siento que me debo a los madrileños también, tengo que estudiar la situación», ha comentado. «Pero con calma», ha agregado.
«¿Alguien ha visto mi estilográfica?», ha preguntado luego el Defensor del Pueblo mientras, a lo lejos, podía oírse una risa maléfica. «Te atraparé, quien quiera que seas», ha exclamado el socialista comprobando que el bolsillo de su camisa estaba manchado de tinta.
"
El Mundo Today,https://www.elmundotoday.com/2021/10/la-llegada-del-fontanero-en-una-calesa-tirada-por-seis-caballos-hace-temer-que-cobrara-el-desplazamiento/,2021-10-26,La llegada del fontanero en una calesa tirada por seis caballos hace temer que cobrará el desplazamiento,IBA ARROJANDO BILLETES A LA GENTE DESDE EL CARROMATO MIENTRAS SE DIRIGÍA AL DOMICILIO DEL CLIENTE,1,"
Un sonido de campanillas, música alegre y el trotar de varios caballos hicieron que los vecinos de La Rondilla, en Valladolid, se asomaran ayer por la mañana al balcón. Entre ellos, Paco Cavas Hernández, que al fijarse bien constató que, montado en una calesa tirada por seis corceles, se acercaba a su portal el fontanero. «Este me cobra el desplazamiento fijo», se dijo apesadumbrado.
«¡Aquí llega el fontanero, señores, el fontanero!», gritaba una modelo en bikini usando un megáfono y saludando de pie a los transeúntes desde lo alto del lujoso carromato. El fontanero, con aire altivo, iba tirando billetes a la gente, que se arremolinaba alrededor de la numerosa comitiva -detrás de la calesa, una banda de músicos seguía al fontanero interpretando simpáticas tonadas y cinco acróbatas hacían malabares para regocijo de los más pequeños-.
La calesa se detuvo frente al número doce y el fontanero, entre gritos de júbilo, se apeó y llamó al interfono. «Ya está aquí el fontanero, caballero, don Jesús Ricota Maluendas, para servirle a usted», exclamó con la boca pegada al aparato. Resignado, Cavas Hernández abrió la puerta. «Qué otra cosa iba a hacer», comenta cabizbajo.
Como era de esperar, el fontanero echó un rápido vistazo al sifón del fregadero y negó con la cabeza. «Este recambio no le tengo», sentenció. Dicho lo cual se fue por donde vino, no sin antes cobrar el desplazamiento. «Mañana, a la misma hora. Ya con el recambio», prometió minutos antes de montarse de nuevo en la calesa y seguir su andadura, arrastrando tras de sí a la jubilosa muchedumbre.
"
El Mundo Today,https://www.elmundotoday.com/2021/11/los-paises-ricos-daran-vacunas-a-los-paises-pobres-para-proteger-a-los-ciudadanos-de-los-paises-ricos/,2021-11-30,Los países ricos darán vacunas a los países pobres para proteger a los ciudadanos de los países ricos,"“SU POBREZA EMPIEZA A AFECTARNOS A NOSOTROS”, LAMENTAN",1,"
Esta semana, los países ricos han decidido dar vacunas a los países pobres porque se han dado cuenta, según han expresado diversos mandatarios reunidos en una cumbre urgente del G-7, de que “la mejor vía para proteger a los países ricos es proteger también a los pobres, aunque esto pueda sonar paradójico o chocante”. Por este motivo, la intención de los países ricos es “ayudar en la medida de lo posible con la inmunización de los países pobres, lo que puede parecer una pérdida de dinero y recursos pero, a la larga, será beneficioso también para nuestros países [los países ricos]”.
“Dando vacunas a los países pobres protegeremos, a la larga, a nuestros ciudadanos… y si algún pobre se beneficia de rebote, eso también podría ser positivo y no está de más”, dicen desde el G-7.
“Ayudar a los países pobres puede parecer una estupidez, pero a lo mejor no lo es tanto”, insisten desde el G-7.
ACTUALIZACIÓN: los países más ricos y con mayores índices de vacunación han decidido que, en vez de ayudar a los 40 países con un porcentaje de vacunación de solo un 1%, administrarán una tercera dosis en sus respectivos países, confiando en que esa estrategia consiga frenar la pandemia de una vez. 
"
